Task ID,Section,Description,Owner,Dependencies,Pre-requisites,Definition of Done,Status,KPIs,Target Sprint,Artifacts To Track,Validation Method,Estimate (O/M/P),Planned Start,Planned Finish,Percent Complete,Dependency Types,Cadence
IFC-279,Core CRM,"Deal Create Form + /deals/new Route. No deal creation form exists — both 'New Deal' buttons (deals/(list)/page.tsx lines 454 and 492) link to /deals/new which is a 404 (F-02). Must: (1) Create page at apps/web/src/app/deals/new/page.tsx or deals/(list)/new/page.tsx. (2) Form fields: name, value (money input), stage (default PROSPECTING), probability, expectedCloseDate (date picker), accountId (account search combobox), contactId (contact search combobox). (3) Wire to trpc.opportunity.create mutation. (4) Add useRequireAuth(). (5) Validate with createOpportunitySchema. (6) Success: navigate to /deals/[newId]. Audit: docs/audit/deal-detail-wiring-audit.md section 1 F-02.",Frontend Dev (STOA-Quality),,FILE:docs/audit/deal-detail-wiring-audit.md,Deal create form page exists; all fields validated; submits via trpc.opportunity.create; success navigates to deal detail; auth guard present; error handling; tests >=90%,Completed,Create form submits successfully; validation errors displayed,16,ARTIFACT:apps/web/src/app/deals/(list)/new/page.tsx;ARTIFACT:apps/web/src/components/deals/DealForm.tsx;SPEC:.specify/sprints/sprint-16/specifications/IFC-279-spec.md;PLAN:.specify/sprints/sprint-16/planning/IFC-279-plan.md;EVIDENCE:.specify/sprints/sprint-16/attestations/IFC-279/attestation.json,VALIDATE:pnpm test --filter @intelliflow/web,120/240/480,2026-03-17,2026-03-17,100,,
IFC-280,Core CRM,Deal Detail Action Buttons — Wire 14 No-Ops. (1) EntityHeader 6 no-ops all with onClick: () => {} (F-08): Won → moveStage CLOSED_WON with success dialog; Lost → moveStage CLOSED_LOST with LossReasonModal (reuse from list page); Edit → navigate to edit form or open inline edit; Clone → duplicate mutation; Archive → set archived status; Delete → AlertDialog confirmation + delete mutation. (2) Stakeholder/Product/File 8 no-ops (F-09): Edit stakeholders → open edit dialog; Account icons → navigate to /accounts/[id] and website; Contact icons → mailto: and tel: links; Add Product → product association dialog; File upload → upload mutation; File links → presigned URL download. Depends on IFC-278 (real data needed for mutations). Audit: docs/audit/deal-detail-wiring-audit.md section 2.,Frontend Dev (STOA-Quality),IFC-278:FS,FILE:docs/audit/deal-detail-wiring-audit.md,Won/Lost buttons trigger moveStage mutations with confirmation; Edit navigates to edit; Clone/Archive/Delete functional with confirmations; stakeholder/product/file buttons all wired; tests >=90%,Completed,14/14 buttons functional; confirmation dialogs for destructive actions,18,ARTIFACT:apps/web/src/app/deals/[id]/page.tsx,VALIDATE:pnpm test --filter @intelliflow/web,240/480/960,2026-06-13,2026-06-13,100,,
IFC-281,Core CRM,Deal Backend Tenant Isolation & Audit Logging. (1) CRITICAL: PrismaOpportunityRepository.findById() (line 82) has NO tenantId WHERE clause — cross-tenant read/write/delete possible via getById/update/delete/moveStage/dealForecast (B-01). Fix: add tenantId to findById() and findByOwnerId() WHERE clauses. (2) CRITICAL: Zero auditLogger.log() calls across all 16 opportunity + pipeline-config procedures (B-02). Add audit logging to create/update/delete/moveStage (especially CLOSED_WON/CLOSED_LOST) and pipeline config changes. (3) Create notification in create procedure uses raw ctx.prisma instead of prismaWithTenant (B-03). Audit: docs/audit/deal-detail-wiring-audit.md sections 5-6.,Backend Dev (STOA-Domain),,FILE:docs/audit/deal-detail-wiring-audit.md,Repository findById/findByOwnerId include tenantId; auditLogger.log on all mutations; notification uses prismaWithTenant; cross-tenant access tests; tests >=90%,Completed,Zero cross-tenant data leaks; audit entries for all 16 procedures,16,ARTIFACT:packages/adapters/src/repositories/PrismaOpportunityRepository.ts;ARTIFACT:apps/api/src/modules/opportunity/opportunity.router.ts;ARTIFACT:apps/api/src/modules/opportunity/pipeline-config.router.ts,VALIDATE:pnpm test --filter @intelliflow/api --filter @intelliflow/adapters,120/240/480,2026-03-18,,100,,SPEC:.specify/sprints/sprint-16/specifications/IFC-281-spec.md;PLAN:.specify/sprints/sprint-16/planning/IFC-281-plan.md
IFC-282,Core CRM,"Deal Router Correctness Fixes. (1) Name updates silently dropped — service has TODO 'Add updateName method' (B-04, OpportunityService.ts:313). Add updateName to domain and wire in service. (2) data.probability?.value unwrapping may be undefined if percentageSchema returns plain number (B-05, router:460). Verify and fix. (3) opportunityListResponseSchema key 'data' vs router key 'opportunities' mismatch (B-07, validators:88 vs router:437). (4) throwOpportunityCreateError maps VALIDATION_ERROR to NOT_FOUND — wrong HTTP semantic (B-09, router:55). (5) validateStageDeactivation throws plain Error → 500 instead of BAD_REQUEST (B-10, validators:214). (6) mapOpportunityToResponse drops closedAt field (B-11, mappers.ts:88-108). (7) CLOSED_LOST no-reason passes Zod but fails at service (B-12, router:322). Audit: docs/audit/deal-detail-wiring-audit.md section 6.",Backend Dev (STOA-Domain),,FILE:docs/audit/deal-detail-wiring-audit.md,Name updates persisted; probability correctly unwrapped; schema key matches router; VALIDATION_ERROR → BAD_REQUEST; validateStageDeactivation throws TRPCError; closedAt included in response; CLOSED_LOST reason properly validated; tests >=90%,Completed,All 7 correctness issues resolved; zero silent data drops,18,ARTIFACT:apps/api/src/modules/opportunity/opportunity.router.ts;ARTIFACT:packages/validators/src/opportunity.ts;ARTIFACT:packages/domain/src/crm/opportunity/Opportunity.ts;ARTIFACT:apps/api/src/shared/mappers.ts,VALIDATE:pnpm test --filter @intelliflow/api --filter @intelliflow/validators --filter @intelliflow/domain,120/240/480,2026-06-13,2026-06-13,100,,
IFC-283,Core CRM,"Deal Event Pipeline — Worker Handlers. (1) Only opportunity.won has a handler in events worker; opportunity.created, opportunity.stage_changed, and opportunity.lost are defined in DOMAIN_EVENT_TYPES but have NO registered handlers (W-01). (2) No OpportunityDescriptionUpdatedEvent defined — description changes emit no event (W-02). Add handlers for the 3 missing event types. Add OpportunityDescriptionUpdatedEvent to domain. Cross-ref: same pattern as Account (IFC-272) and Contact (IFC-261). Audit: docs/audit/deal-detail-wiring-audit.md section 7.",Backend Dev (STOA-Domain),,FILE:docs/audit/deal-detail-wiring-audit.md,Events worker has handlers for opportunity.created/stage_changed/lost; OpportunityDescriptionUpdatedEvent added to domain; all 5 event types handled; tests >=90%,Backlog,5/5 opportunity event types handled in worker,22,ARTIFACT:apps/workers/events-worker/src/main.ts;ARTIFACT:packages/domain/src/crm/opportunity/OpportunityEvents.ts,VALIDATE:pnpm test --filter @intelliflow/events-worker --filter @intelliflow/domain,120/240/480,,,0,,
IFC-284,Core CRM,"Deal Forecast Algorithm Fixes. (1) buildWinRateTrend hardcodes months ['May','Jun','Jul','Aug','Sep','Oct'] regardless of current date — semantically incorrect data (B-06, forecast-algorithm.ts:283). Fix to derive from actual 6-month window. (2) DEFAULT_STAGE_PROBABILITIES diverge: validators has NEEDS_ANALYSIS=30/PROPOSAL=70 while domain/service/router/forecast-algorithm uses 40/60 (B-08). Unify to single source of truth. (3) buildMonthlyRevenue uses locale-dependent toLocaleString for month names — breaks on non-en-US servers (B-15, forecast-algorithm.ts:269). (4) Forecast trend values hardcoded as 12 and 5 in forecast page (F-16, deals/forecast/page.tsx:709-710). Compute from API data. Audit: docs/audit/deal-detail-wiring-audit.md sections 4, 6.",Backend Dev (STOA-Domain),,FILE:docs/audit/deal-detail-wiring-audit.md,Win rate trend months derived from current date; stage probabilities unified to single source; month names locale-independent; forecast trends computed from data; tests >=90%,Backlog,Win rate trend matches actual date window; single probability source,20,ARTIFACT:apps/api/src/shared/forecast-algorithm.ts;ARTIFACT:packages/validators/src/opportunity.ts;ARTIFACT:apps/web/src/app/deals/forecast/page.tsx,VALIDATE:pnpm test --filter @intelliflow/api --filter @intelliflow/validators --filter @intelliflow/web,120/240/480,,,0,,
IFC-285,Core CRM,"Deal Service Dead Code & Minor Fixes. (1) 11 dead service methods unreachable from router: listOpportunities, advanceStage, updateValue, updateProbability, updateExpectedCloseDate, reopenOpportunity, getPipelineForecast, getOpportunitiesClosingSoon, getHighValueOpportunities, getOpportunitiesByAccount, getOpportunitiesByContact, getWinRateStatistics (B-13). Decide: wire to router or remove. (2) toMoney/toPercentage silent zero fallback on DB corruption (B-14). (3) TOCTOU in stage transitions — no optimistic locking (B-16). (4) Event publish failure swallowed with console.error only (B-17). (5) DealQuickView is a 49-line stub not used anywhere (F-13). (6) RecommendedActions.onActionClick not wired at forecast page level (F-18). (7) Sidebar deals config settingsHref points to /settings/deals instead of /settings/pipeline (W-03). Audit: docs/audit/deal-detail-wiring-audit.md sections 6-7.",Backend Dev (STOA-Domain),,FILE:docs/audit/deal-detail-wiring-audit.md,Dead code either wired to router or removed; toMoney/toPercentage propagate errors; event publish has retry; DealQuickView wired or removed; sidebar settingsHref fixed; tests >=90%,Backlog,Zero dead code methods; zero silent error swallowing,24,ARTIFACT:packages/application/src/services/OpportunityService.ts;ARTIFACT:packages/adapters/src/repositories/PrismaOpportunityRepository.ts;ARTIFACT:apps/web/src/components/deals/DealQuickView.tsx;ARTIFACT:apps/web/src/components/sidebar/configs/deals.ts,VALIDATE:pnpm test --filter @intelliflow/application --filter @intelliflow/adapters --filter @intelliflow/web,120/240/480,,,0,,
IFC-286,Core CRM,"Deal Detail Page Tests + E2E. (1) Deal detail page (792 lines) has ZERO test coverage (T-01). (2) No E2E Playwright tests for /deals, /deals/[id], or /deals/forecast — only pipeline-settings has E2E (T-02). (3) No cross-tenant access attempt test in router tests (T-03). (4) Contract test missing NEEDS_ANALYSIS stage in test data (T-04). Depends on IFC-278 (real data) and IFC-280 (wired buttons). Audit: docs/audit/deal-detail-wiring-audit.md section 10.",Frontend Dev (STOA-Quality),IFC-278:FS;IFC-280:FS,FILE:docs/audit/deal-detail-wiring-audit.md,Deal detail page test file with >=20 tests; E2E create-view-edit-delete flow; router tests for cross-tenant access; contract test includes NEEDS_ANALYSIS; coverage >=90%,Backlog,Deal detail page test coverage >=90%; E2E CRUD flow passing,20,ARTIFACT:apps/web/src/app/deals/[id]/__tests__/page.test.tsx;ARTIFACT:tests/e2e/deal-crud.spec.ts;ARTIFACT:apps/api/src/__tests__/contract/opportunity.contract.test.ts,VALIDATE:pnpm test --filter @intelliflow/web --filter @intelliflow/api && npx playwright test,240/480/960,,,0,,
IFC-287,Core CRM,"Deal Filter Wiring & Type Safety. (1) DealFilters state (filters) captured in page but NEVER passed to trpc.opportunity.list.useQuery — ownerId and dateRange selections have no effect on kanban view data (F-10, deals/(list)/page.tsx:214,226). (2) 'More Filters' button has no onClick handler (F-11, DealFilters.tsx). (3) Owner filter only has 2 hardcoded options: 'All Deals' and 'My Deals' — no dynamic user list (F-12). (4) transformDeals uses loose Record<string,unknown> casting at API boundary instead of typed response (F-19, types.ts:102-119). Wire filters to API query params; add server-side owner filter with user list; type-safe API response handling. Audit: docs/audit/deal-detail-wiring-audit.md sections 3, 8.",Frontend Dev (STOA-Quality),,FILE:docs/audit/deal-detail-wiring-audit.md,DealFilters ownerId/dateRange passed to API query; More Filters opens filter panel; owner dropdown shows team members from API; transformDeals properly typed; tests >=90%,Completed,Filter selections affect displayed data; owner list from API,18,ARTIFACT:apps/web/src/app/deals/(list)/page.tsx;ARTIFACT:apps/web/src/components/deals/DealFilters.tsx;ARTIFACT:apps/web/src/components/deals/types.ts,VALIDATE:pnpm test --filter @intelliflow/web,60/120/240,2026-06-14,2026-06-15,100,,
IFC-288,Core CRM,"Analytics Dashboard Endpoint Wiring. Wire 9 dead analytics router endpoints: exportConversionFunnel, exportMetrics, exportReport, getConversionFunnel, getLeadMetrics, getOverview, getSalesMetrics, getTimeSeriesData, leadStats. Backend built (ANALYTICS-001), zero web callers. Decision: wire to analytics dashboard UI (IFC-037) with charts/export buttons. Audit: artifacts/reports/dead-endpoints-audit.csv rows 20-28.",Frontend Dev (STOA-Quality),IFC-037:FS,FILE:artifacts/reports/dead-endpoints-audit.csv,All 9 analytics endpoints wired to dashboard UI with working charts/exports; zero dead endpoints in analytics router; tests >=90%,Backlog,9/9 analytics endpoints wired to UI,21,ARTIFACT:apps/api/src/modules/analytics/analytics.router.ts;ARTIFACT:apps/web/src/app/analytics/(list)/page.tsx,VALIDATE:pnpm test --filter @intelliflow/api --filter @intelliflow/web,120/240/480,,,0,,
IFC-289,Core CRM,"Agent/Conversation Router Frontend Wiring. 17 dead endpoints (13 conversation.* + 4 agent.*) with zero frontend callers. Frontend uses autoResponse/aiReview/aiMonitoring routers that query the same DB tables directly bypassing the canonical conversation router. Fix: wire all endpoints to proper frontend consumers — chat panel, agent-approvals, AI Search, admin dashboard — and refactor aiMonitoring to delegate to conversation router instead of duplicating DB queries. Audit: artifacts/reports/dead-endpoints-audit.csv rows 4-18.",Frontend Dev (STOA-Quality),IFC-139:FS;IFC-148:FS,FILE:artifacts/reports/dead-endpoints-audit.csv,All 17 endpoints wired to frontend callers; aiMonitoring delegates to conversation router (no duplicate Prisma queries); agent-approvals uses conversation.approveToolCall/escalate/getPendingApprovals; AI Search wires conversation.search; admin dashboard wires getAnalytics/archiveOld; zero dead endpoints in Knip; tests >=90%,Backlog,17/17 dead endpoints wired to frontend consumers,22,ARTIFACT:apps/api/src/modules/agent/conversation.router.ts;ARTIFACT:apps/api/src/modules/agent/agent.router.ts;ARTIFACT:apps/api/src/modules/ai-monitoring/ai-monitoring.router.ts;ARTIFACT:apps/web/src/app/agent-approvals/page.tsx;ARTIFACT:apps/web/src/components/ai-monitoring/AgentLogsViewer.tsx;ARTIFACT:apps/web/src/components/ai-intelligence/AISearchPage.tsx,VALIDATE:pnpm test --filter @intelliflow/api --filter @intelliflow/web,120/240/480,,,0,,
IFC-290,Core CRM,"Integrations Dashboard Endpoint Wiring. Wire 5 dead integrations router endpoints: getAllConnectorsHealth, getConnectorHealth, getConnectorsByType, getDashboardConfig, triggerSync. Backend built (IFC-003), zero web callers. Decision: build integrations settings page to consume these. Audit: artifacts/reports/dead-endpoints-audit.csv rows 61-65.",Frontend Dev (STOA-Quality),,FILE:artifacts/reports/dead-endpoints-audit.csv,All 5 integrations endpoints wired to dashboard UI; zero dead endpoints in integrations router; tests >=90%,Backlog,5/5 integrations endpoints wired to UI,23,ARTIFACT:apps/api/src/modules/integrations/integrations.router.ts,VALIDATE:pnpm test --filter @intelliflow/api --filter @intelliflow/web,120/240/480,,,0,,
IFC-291,Core CRM,"Feedback Submission UI Wiring. Wire 5 dead feedback router endpoints: checkRetraining, exportTrainingData, getForLead, submitCorrection, submitSimple. Backend built (IFC-068), zero web callers. Decision: add feedback UI to AI review workflow. Audit: artifacts/reports/dead-endpoints-audit.csv rows 55-60.",Frontend Dev (STOA-Quality),IFC-068:FS,FILE:artifacts/reports/dead-endpoints-audit.csv,All 5 feedback endpoints wired to feedback UI; zero dead endpoints in feedback router; tests >=90%,Backlog,5/5 feedback endpoints wired to UI,23,ARTIFACT:apps/api/src/modules/feedback/feedback.router.ts,VALIDATE:pnpm test --filter @intelliflow/api --filter @intelliflow/web,120/240/480,,,0,,
IFC-292,Core CRM,"Legal Document Management UI Wiring. Wire 6 dead legal router endpoints: appointments.findNextSlot, documents.grantAccess, documents.placeLegalHold, documents.releaseLegalHold, documents.revokeAccess, documents.submitForReview. Backend built (IFC-137, IFC-140, IFC-152), zero web callers. Decision: build legal management UIs to consume these. Audit: artifacts/reports/dead-endpoints-audit.csv rows 78-83.",Frontend Dev (STOA-Quality),IFC-140:FS;IFC-152:FS,FILE:artifacts/reports/dead-endpoints-audit.csv,All 6 legal endpoints wired to management UI; zero dead endpoints in legal router; tests >=90%,Backlog,6/6 legal endpoints wired to UI,24,ARTIFACT:apps/api/src/modules/legal/documents.router.ts;ARTIFACT:apps/api/src/modules/legal/appointments.router.ts,VALIDATE:pnpm test --filter @intelliflow/api --filter @intelliflow/web,120/240/480,,,0,,
IFC-293,Core CRM,"Security Admin + Notifications Settings Wiring. Wire 6 dead endpoints: security.audit.getByResource, security.audit.getMyActivity, security.audit.getSecurityEvents, notifications.batchAction, notifications.getPreferences, notifications.updatePreferences. Backend built (IFC-098, IFC-072, IFC-046, IFC-157), zero web callers. Decision: build admin security page + notification settings page (PG-116). Audit: artifacts/reports/dead-endpoints-audit.csv rows 93-95, 101-103.",Frontend Dev (STOA-Quality),IFC-157:FS,FILE:artifacts/reports/dead-endpoints-audit.csv,All 6 security/notification endpoints wired to admin pages; zero dead endpoints in security.audit and notifications routers; tests >=90%,Backlog,6/6 security+notification endpoints wired to UI,24,ARTIFACT:apps/api/src/security/audit/audit-logger.ts;ARTIFACT:apps/api/src/modules/notifications/notifications.router.ts,VALIDATE:pnpm test --filter @intelliflow/api --filter @intelliflow/web,120/240/480,,,0,,
IFC-294,Core CRM,"Experiment + Intelligence + AI Monitoring Wiring. Wire 7 dead endpoints: experiment.assignVariant, experiment.recordConversion, experiment.recordScore, intelligence.getInsightsSummary, intelligence.triggerPrediction, intelligence.updateContactInsights, ai-monitoring.getHallucinationReport. Backend built (IFC-025, IFC-095, IFC-117), zero web callers. Decision: wire to experiment dashboard (IFC-181) and AI monitoring page. Audit: artifacts/reports/dead-endpoints-audit.csv rows 19, 52-54, 66-69.",Frontend Dev (STOA-Quality),IFC-025:FS;IFC-095:FS,FILE:artifacts/reports/dead-endpoints-audit.csv,All 7 experiment/intelligence/AI-monitoring endpoints wired to dashboards; zero dead endpoints in these routers; tests >=90%,Backlog,7/7 experiment+intelligence+AI-monitoring endpoints wired to UI,25,ARTIFACT:apps/api/src/modules/intelligence/intelligence.router.ts,VALIDATE:pnpm test --filter @intelliflow/api --filter @intelliflow/web,120/240/480,,,0,,
IFC-295,Core CRM,"Billing/Auth/Subscription/Admin Miscellaneous Wiring. Wire 8 dead endpoints: billing.ensureCustomer, billing.getUsageMetrics, billing.updateBillingInformation, auth.getSessions, subscription.getPlans, subscription.toggleModule, autoresponse.submitForApproval, admin.queues.getByName. Backend built across IFC-006/IFC-014/IFC-028/IFC-099, zero web callers. admin.queues.getByName is completely phantom (no tests, no matrix entry) � needs queue inspector or admin tools UI. Audit: artifacts/reports/dead-endpoints-audit.csv rows 2, 29, 33-37, 104-105.",Frontend Dev (STOA-Quality),,FILE:artifacts/reports/dead-endpoints-audit.csv,All 8 miscellaneous endpoints wired to appropriate UI pages; zero dead endpoints in billing/auth/subscription/autoresponse/admin routers; tests >=90%,Backlog,8/8 misc endpoints wired to UI,25,ARTIFACT:apps/api/src/modules/billing/billing.router.ts;ARTIFACT:apps/api/src/modules/auth/auth.router.ts,VALIDATE:pnpm test --filter @intelliflow/api --filter @intelliflow/web,120/240/480,,,0,,