"Task ID","Section","Description","Owner","Dependencies","Pre-requisites","Definition of Done","Status","KPIs","Target Sprint","Artifacts To Track","Validation Method"
"EXC-INIT-001","AI Foundation","Sprint 0 - Environment Setup with Agent Ecosystem","Tech Lead (STOA-Foundation)","","FILE:artifacts/sprint0/codex-run/Framework.md;FILE:audit-matrix.yml;POLICY:Budget approved;ENV:AI tools access;ENV:GitHub Enterprise;FILE:docs/planning/adr/ADR-006-agent-tools.md;FILE:docs/shared/review-checklist.md;FILE:docs/operations/pr-checklist.md;FILE:docs/operations/project-playbook.md","Complete AI-enhanced environment with automation pipelines operational; artifacts: setup-complete-checklist.md, automation-metrics.json, pipeline-status.yaml; targets: >=80%, zero errors; verified by: pnpm test","Completed","Setup time <4 hours total, 80% tasks automated, zero manual configuration errors","0","ARTIFACT:docs/agent/setup-complete-checklist.md;ARTIFACT:artifacts/metrics/automation-metrics.json;ARTIFACT:artifacts/misc/pipeline-status.yaml;EVIDENCE:artifacts/attestations/EXC-INIT-001/context_ack.json","VALIDATE:pnpm test"
"AI-SETUP-001","AI Foundation","Configure Claude Code with Custom Commands and Hooks","AI Specialist (STOA-Intelligence)","EXC-INIT-001","FILE:artifacts/sprint0/codex-run/Framework.md;FILE:audit-matrix.yml;ENV:Claude Code access;ENV:project repository created;FILE:docs/agent/setup-complete-checklist.md",".claude/commands configured, hooks system active, slash commands tested; targets: >=100%, <100ms","Completed","100% commands functional, hooks triggering <100ms","0","ARTIFACT:artifacts/misc/command-test-results.csv;EVIDENCE:artifacts/attestations/AI-SETUP-001/context_ack.json","AUDIT:manual-review;VALIDATE:pnpm test"
"AI-SETUP-002","AI Foundation","GitHub Copilot Enterprise Automation Setup","AI Specialist (STOA-Intelligence)","AI-SETUP-001","FILE:artifacts/sprint0/codex-run/Framework.md;FILE:audit-matrix.yml;ENV:GitHub Enterprise;ENV:Copilot licenses;FILE:docs/planning/adr/ADR-005-workflow-engine.md;FILE:docs/shared/review-checklist.md;FILE:docs/operations/pr-checklist.md;FILE:artifacts/misc/command-test-results.csv","copilot-instructions.md created, copilot-setup-steps.yml automated, coding agent enabled; targets: >=100%, <2s","Completed","Copilot response <2s, 100% team access, automation workflows active","0","ARTIFACT:docs/shared/copilot-instructions.md;ARTIFACT:artifacts/misc/team-licenses.csv;ARTIFACT:artifacts/misc/workflow-automation.yaml;EVIDENCE:artifacts/attestations/AI-SETUP-002/context_ack.json","AUDIT:manual-review"
"AI-SETUP-003","AI Foundation","External AI Tools Integration (Codex, Jules)","AI Specialist (STOA-Intelligence)","AI-SETUP-001","FILE:artifacts/sprint0/codex-run/Framework.md;FILE:audit-matrix.yml;ENV:API keys configured;ENV:sandbox environments;FILE:docs/planning/adr/ADR-006-agent-tools.md;FILE:artifacts/misc/command-test-results.csv","Codex CLI configured, Jules connected, security sandboxing verified, automation triggers set; targets: <5s; verified by: pnpm test, pnpm test:integration; gates: security-scan-pass","Completed","External tools integrated, sandboxing validated, <5s response time","0","ARTIFACT:artifacts/misc/sandbox-security.json;ARTIFACT:artifacts/metrics/response-metrics.csv;ARTIFACT:apps/ai-worker/src/agents/base.agent.ts;ARTIFACT:apps/ai-worker/src/agents/base.agent.test.ts;ARTIFACT:apps/ai-worker/src/agents/crew.ts;ARTIFACT:apps/ai-worker/src/agents/crew.test.ts;ARTIFACT:apps/ai-worker/src/agents/qualification.agent.ts;ARTIFACT:apps/ai-worker/src/agents/qualification.agent.test.ts;ARTIFACT:apps/ai-worker/src/chains/embedding.chain.ts;ARTIFACT:apps/ai-worker/src/chains/embedding.chain.test.ts;ARTIFACT:apps/ai-worker/README.md;ARTIFACT:apps/ai-worker/QUICKSTART.md;ARTIFACT:apps/ai-worker/STRUCTURE.txt;EVIDENCE:artifacts/attestations/AI-SETUP-003/context_ack.json","VALIDATE:pnpm test;VALIDATE:pnpm test:integration;GATE:security-scan-pass"
"ENV-001-AI","Foundation Setup","Automated Monorepo Creation","Tech Lead + Claude Code (STOA-Automation)","AI-SETUP-001","FILE:artifacts/sprint0/codex-run/Framework.md;FILE:audit-matrix.yml;ENV:Claude Code ready;ENV:automation commands configured;FILE:docs/architecture/repo-layout.md;FILE:artifacts/misc/command-test-results.csv","Monorepo generated via Claude slash command, structure validated, AI-optimized configuration; targets: >=100%, <10 min, zero errors; verified by: pnpm build","Completed","Setup <10 minutes, zero manual steps, 100% best practices applied","0","ARTIFACT:turbo.json;ARTIFACT:pnpm-workspace.yaml;ARTIFACT:apps/ai-worker/package.json;ARTIFACT:apps/ai-worker/tsconfig.json;ARTIFACT:apps/ai-worker/vitest.config.ts;ARTIFACT:apps/ai-worker/.env.example;ARTIFACT:apps/ai-worker/.eslintrc.js;ARTIFACT:apps/ai-worker/.gitignore;ARTIFACT:apps/api/package.json;ARTIFACT:apps/api/src/index.ts;ARTIFACT:apps/api/src/context.ts;ARTIFACT:packages/domain/package.json;ARTIFACT:packages/domain/tsconfig.json;ARTIFACT:packages/application/package.json;ARTIFACT:packages/application/tsconfig.json;ARTIFACT:packages/adapters/package.json;ARTIFACT:packages/adapters/tsconfig.json;ARTIFACT:packages/validators/package.json;ARTIFACT:packages/validators/tsconfig.json;ARTIFACT:packages/db/package.json;ARTIFACT:packages/db/tsconfig.json;ARTIFACT:packages/ui/package.json;ARTIFACT:packages/ui/tsconfig.json;ARTIFACT:packages/api-client/package.json;ARTIFACT:packages/api-client/tsconfig.json;ARTIFACT:packages/typescript-config/package.json;ARTIFACT:packages/typescript-config/base.json;ARTIFACT:packages/typescript-config/nextjs.json;ARTIFACT:packages/typescript-config/react.json;ARTIFACT:packages/typescript-config/react-library.json;EVIDENCE:artifacts/attestations/ENV-001-AI/context_ack.json","VALIDATE:pnpm build"
"ENV-002-AI","Foundation Setup","Automated Development Tools Configuration","Backend Dev + AI Specialist (STOA-Intelligence)","ENV-001-AI","FILE:artifacts/sprint0/codex-run/Framework.md;FILE:audit-matrix.yml;ENV:Monorepo ready;ENV:Copilot automation active;FILE:docs/planning/adr/ADR-006-agent-tools.md;FILE:docs/operations/engineering-playbook.md;FILE:turbo.json","ESLint/Prettier AI-configured, Husky hooks with AI validation, conventional commits automated; targets: <5 min, zero errors; verified by: pnpm lint","Completed","Configuration time <5 minutes, AI-suggested rules applied, zero conflicts","0","ARTIFACT:.eslintrc.js;ARTIFACT:.prettierrc;ARTIFACT:artifacts/misc/commitlint.config.js;ARTIFACT:artifacts/misc/lint-results.json;ARTIFACT:artifacts/misc/env-validation-results.json;EVIDENCE:artifacts/attestations/ENV-002-AI/context_ack.json","VALIDATE:pnpm lint"
"ENV-003-AI","Foundation Setup","Docker Environment with Optimized Configuration","DevOps + Claude Code (STOA-Automation)","ENV-001-AI","FILE:artifacts/sprint0/codex-run/Framework.md;FILE:audit-matrix.yml;ENV:Docker Desktop;ENV:Claude Code hooks active;FILE:turbo.json","Docker Compose AI-generated, resource optimization applied, auto-scaling configured; targets: <2 min","Completed","Environment up <2 minutes, AI-optimized resource usage, self-healing enabled","0","ARTIFACT:docker-compose.yml;ARTIFACT:artifacts/misc/health-check.yaml;EVIDENCE:artifacts/attestations/ENV-003-AI/context_ack.json","AUDIT:manual-review"
"ENV-004-AI","Foundation Setup","Supabase Integration with Automated Schema Design","Backend Dev + AI Agents (STOA-Intelligence)","ENV-003-AI","FILE:artifacts/sprint0/codex-run/Framework.md;FILE:audit-matrix.yml;ENV:Supabase account;ENV:AI schema generation ready;FILE:docs/planning/adr/ADR-001-modern-stack.md;FILE:packages/db/prisma/schema.prisma;FILE:docs/design-system/token-mapping.md;FILE:docs/company/brand/visual-identity.md;FILE:docker-compose.yml","Connection established, pgvector optimized by AI, schema AI-validated for performance; targets: >=100%, <30ms","Completed","Connection <30ms, AI-optimized indexes, 100% type safety verified","0","ARTIFACT:supabase/config.toml;ARTIFACT:supabase/.gitignore;EVIDENCE:artifacts/attestations/ENV-004-AI/context_ack.json","AUDIT:manual-review"
"ENV-005-AI","Foundation Setup","CI/CD Pipeline with Predictive Optimization","DevOps + Claude Code (STOA-Automation)","ENV-002-AI","FILE:artifacts/sprint0/codex-run/Framework.md;FILE:audit-matrix.yml;ENV:GitHub Actions;ENV:AI automation hooks;FILE:docs/shared/review-checklist.md;FILE:docs/operations/quality-gates.md;FILE:docs/operations/pr-checklist.md;FILE:.eslintrc.js","Pipeline AI-generated, predictive caching, self-optimizing workflows, security gates automated; artifacts: ci.yml, cd.yml, context_ack.json; targets: >=95%, <5 min","Completed","Pipeline <5 minutes, 95% cache hit rate, AI-predicted optimization applied","0","ARTIFACT:.github/workflows/ci.yml;ARTIFACT:.github/workflows/cd.yml;ARTIFACT:artifacts/misc/env-validation-results.json;EVIDENCE:artifacts/attestations/ENV-005-AI/context_ack.json","AUDIT:manual-review;AUDIT:security-review"
"ENV-006-AI","Foundation Setup","Prisma Schema with Generated Optimizations","Backend Dev + Copilot (STOA-Automation)","ENV-004-AI","FILE:artifacts/sprint0/codex-run/Framework.md;FILE:audit-matrix.yml;ENV:Database ready;POLICY:AI schema analysis complete;FILE:packages/db/prisma/schema.prisma;FILE:docs/shared/review-checklist.md;FILE:docs/operations/pr-checklist.md;FILE:supabase/config.toml","Schema AI-optimized, migrations AI-tested, seed data AI-generated, performance validated; targets: >=100%, <15s","Completed","Migration time <15s, AI-verified indexes, 100% query optimization","0","ARTIFACT:packages/db/prisma/schema.prisma;ARTIFACT:packages/db/prisma/seed.ts;EVIDENCE:artifacts/attestations/ENV-006-AI/context_ack.json","AUDIT:manual-review;VALIDATE:pnpm test"
"ENV-007-AI","Foundation Setup","tRPC Setup with Automated Type Generation","Tech Lead + Claude Code (STOA-Automation)","ENV-006-AI","FILE:artifacts/sprint0/codex-run/Framework.md;FILE:audit-matrix.yml;ENV:Prisma ready;ENV:AI type generation active;FILE:docs/planning/adr/ADR-001-modern-stack.md;FILE:packages/db/prisma/schema.prisma","tRPC AI-configured, routers auto-generated, type safety AI-verified, error handling automated; targets: <30s, zero errors","Completed","Type generation <30s, zero type errors, AI-validated contracts","0","ARTIFACT:apps/api/src/router.ts;ARTIFACT:apps/web/src/lib/trpc.ts;EVIDENCE:artifacts/attestations/ENV-007-AI/context_ack.json","AUDIT:manual-review"
"ENV-008-AI","Foundation Setup","Automated Observability with Predictive Monitoring","Backend Dev + AI Specialist (STOA-Intelligence)","ENV-005-AI","FILE:artifacts/sprint0/codex-run/Framework.md;FILE:audit-matrix.yml;POLICY:Monitoring tools selected;ENV:AI analysis ready;FILE:docs/shared/review-checklist.md;FILE:docs/operations/pr-checklist.md;FILE:.github/workflows/ci.yml","OpenTelemetry AI-configured, predictive alerts set, anomaly detection active, self-healing enabled; targets: >=100%","Completed","100% services emit traces/metrics/logs; alerting configured; SLOs defined; dashboards live","0","ARTIFACT:artifacts/misc/otel-config.yaml;ARTIFACT:artifacts/misc/anomaly-detection.json;ARTIFACT:artifacts/misc/self-healing-rules.yaml;ARTIFACT:artifacts/misc/otel-implementation/correlation-patterns.md;ARTIFACT:artifacts/misc/otel-implementation/implementation-guide.md;ARTIFACT:artifacts/misc/otel-implementation/instrumentation-checklist.md;EVIDENCE:artifacts/attestations/ENV-008-AI/context_ack.json","AUDIT:manual-review"
"ENV-009-AI","Foundation Setup","Frontend with Generated Components and Optimization","Frontend Dev + Claude Code (STOA-Automation)","ENV-001-AI","FILE:artifacts/sprint0/codex-run/Framework.md;FILE:audit-matrix.yml;ENV:Design system;ENV:AI component generation;FILE:docs/company/brand/visual-identity.md;FILE:turbo.json","Next.js 16.0.10 App Router baseline, Turbopack FS caching enabled, Cache Components used where appropriate, proxy replaces middleware where required; shadcn components AI-selected, performance AI-tuned, accessibility verified; targets: <1s; gates: lighthouse-gte-90","Completed","Lighthouse >95, AI-generated components, load time <1s","0","EVIDENCE:artifacts/attestations/ENV-009-AI/context_ack.json","GATE:lighthouse-gte-90"
"ENV-010-AI","Foundation Setup","Automated Test Generation and Automation","QA Lead + AI Testing Suite (STOA-Quality)","ENV-007-AI,ENV-009-AI","FILE:artifacts/sprint0/codex-run/Framework.md;FILE:audit-matrix.yml;ENV:AI test generation tools;ENV:coverage targets;FILE:docs/planning/adr/ADR-005-workflow-engine.md;FILE:docs/tdd-guidelines.md;FILE:apps/api/src/router.ts","Tests AI-generated, coverage AI-optimized, E2E scenarios AI-created, continuous validation; artifacts: index.html, context_ack.json; targets: >=90%, <1 min; gates: coverage-gte-90","Completed","Coverage >90%, test generation <1 minute, AI-verified scenarios","0","ARTIFACT:artifacts/coverage/index.html;EVIDENCE:artifacts/attestations/ENV-010-AI/context_ack.json","VALIDATE:pnpm test;GATE:coverage-gte-90"
"ENV-011-AI","Foundation Setup","LangChain Integration with Optimized Chains","AI Specialist + Claude Code (STOA-Intelligence)","ENV-007-AI","FILE:artifacts/sprint0/codex-run/Framework.md;FILE:audit-matrix.yml;ENV:OpenAI access;ENV:AI chain optimization;FILE:apps/api/src/router.ts","LangChain AI-configured, chains AI-optimized, rate limiting AI-managed, cost prediction active","Completed","Workflow runtime P95 < 300ms per step (baseline); cost logging enabled; deterministic replays supported","0","EVIDENCE:artifacts/attestations/ENV-011-AI/context_ack.json","AUDIT:manual-review"
"ENV-012-AI","Foundation Setup","Documentation with Auto-Generation","Tech Writer + AI Agents (STOA-Intelligence)","ENV-001-AI","FILE:artifacts/sprint0/codex-run/Framework.md;FILE:audit-matrix.yml;ENV:Docusaurus setup;ENV:AI content generation;FILE:turbo.json","Docs AI-generated, LLM-optimized structure, auto-updating enabled, multi-language support; artifacts: docusaurus.config.js, context_ack.json; targets: >=100%, <30s; gates: coverage-gte-90","Completed","Doc generation <30s, 100% coverage, AI readability score >90","0","ARTIFACT:docs/docusaurus.config.js;ARTIFACT:artifacts/misc/docusaurus.config.js;EVIDENCE:artifacts/attestations/ENV-012-AI/context_ack.json","GATE:coverage-gte-90"
"ENV-013-AI","Foundation Setup","Automated Security Implementation","Security Eng + AI Security Tools (STOA-Security)","ENV-005-AI,ENV-007-AI,ENV-009-AI","FILE:artifacts/sprint0/codex-run/Framework.md;FILE:audit-matrix.yml;ENV:Security AI tools;ENV:threat models;FILE:docs/security/zero-trust-design.md;FILE:docs/operations/engineering-playbook.md;FILE:.github/workflows/ci.yml;FILE:apps/api/src/router.ts","Security AI-audited, vulnerabilities AI-detected, patches AI-applied, compliance verified; artifacts: security-scan-results.json, compliance-report.md, patch-log.csv; targets: >=100%, zero errors","Completed","Zero high vulnerabilities, AI security score A+, compliance 100%","0","ARTIFACT:artifacts/misc/security-scan-results.json;ARTIFACT:artifacts/reports/compliance-report.md;ARTIFACT:artifacts/logs/patch-log.csv;ARTIFACT:artifacts/reports/security/pnpm-audit-latest.json;EVIDENCE:artifacts/attestations/ENV-013-AI/context_ack.json","AUDIT:manual-review;AUDIT:security-review"
"ENV-014-AI","Foundation Setup","Performance Optimization with AI Profiling","Performance Eng + AI Tools (STOA-Quality)","ENV-009-AI","FILE:artifacts/sprint0/codex-run/Framework.md;FILE:audit-matrix.yml;ENV:Performance AI tools;POLICY:metrics defined;FILE:docs/shared/review-checklist.md;FILE:docs/operations/pr-checklist.md","Performance AI-profiled, optimizations AI-applied, predictive scaling configured; targets: >=40%","Completed","Performance gain >40%, AI-optimized bundles, predictive caching active","0","ARTIFACT:artifacts/misc/profiling-results.json;ARTIFACT:artifacts/logs/optimization-log.csv;ARTIFACT:artifacts/misc/cache-config.yaml;ARTIFACT:artifacts/misc/security-baseline.json;EVIDENCE:artifacts/attestations/ENV-014-AI/context_ack.json","AUDIT:manual-review"
"ENV-015-AI","Foundation Setup","AI-Managed Feature Flags with Predictive Rollout","Backend Dev + AI Agents (STOA-Intelligence)","ENV-007-AI","FILE:artifacts/sprint0/codex-run/Framework.md;FILE:audit-matrix.yml;ENV:Feature flag system;ENV:AI rollout engine;FILE:docs/shared/review-checklist.md;FILE:docs/operations/pr-checklist.md;FILE:apps/api/src/router.ts","Flags AI-managed, rollout AI-optimized, A/B tests AI-designed, results AI-analyzed; artifacts: rollout-config.json, ab-test-results.csv, prediction-accuracy.json; targets: >=90%, <30s","Completed","Flag deployment <30s, AI-optimized rollout, prediction accuracy >90%","0","ARTIFACT:artifacts/misc/rollout-config.json;ARTIFACT:artifacts/misc/ab-test-results.csv;ARTIFACT:artifacts/metrics/prediction-accuracy.json;EVIDENCE:artifacts/attestations/ENV-015-AI/context_ack.json","AUDIT:manual-review;VALIDATE:pnpm test"
"ENV-016-AI","Foundation Setup","Privacy-First Analytics with AI Insights","Frontend Dev + AI Analytics (STOA-Intelligence)","ENV-009-AI,ANALYTICS-001","FILE:artifacts/sprint0/codex-run/Framework.md;FILE:audit-matrix.yml;POLICY:Analytics strategy;ENV:AI insight engine;FILE:docs/shared/review-checklist.md;FILE:docs/operations/pr-checklist.md;FILE:docs/analytics/rfm-abc-spec.md","Analytics AI-configured, insights AI-generated, privacy AI-verified, predictions active","Completed","Feature flag framework live; audit log events captured; privacy baseline reviewed (DPIA draft)","0","ARTIFACT:artifacts/misc/privacy-config.json;ARTIFACT:artifacts/metrics/insights-accuracy.csv;ARTIFACT:artifacts/reports/gdpr-compliance.md;ARTIFACT:artifacts/misc/analytics/event-schema.json;ARTIFACT:artifacts/misc/analytics/README.md;EVIDENCE:artifacts/attestations/ENV-016-AI/context_ack.json","AUDIT:manual-review"
"ENV-017-AI","Foundation Setup","Automated Integration Testing","All Teams + AI Orchestrator (STOA-Intelligence)","ENV-001-AI,ENV-003-AI,ENV-005-AI,ENV-010-AI,IFC-001","FILE:artifacts/sprint0/codex-run/Framework.md;FILE:audit-matrix.yml;ENV:All components ready;ENV:AI orchestration active;FILE:docs/tdd-guidelines.md;FILE:turbo.json;FILE:docker-compose.yml;FILE:.github/workflows/ci.yml;FILE:artifacts/coverage/index.html;FILE:docs/planning/adr/ADR-001-modern-stack.md","System AI-tested, issues AI-detected and fixed, demo AI-prepared, metrics AI-verified; artifacts: test-orchestration.json, bug-fixes.log, confidence-metrics.csv; targets: zero errors","Completed","Smoke + integration suite green; zero P0/P1 defects; test execution time <= 15 min in CI","1","ARTIFACT:artifacts/misc/test-orchestration.json;ARTIFACT:artifacts/logs/bug-fixes.log;ARTIFACT:artifacts/metrics/confidence-metrics.csv;EVIDENCE:artifacts/attestations/ENV-017-AI/context_ack.json","VALIDATE:pnpm test"
"ENV-018-AI","Foundation Setup","Sprint Planning and Velocity Prediction","PM + AI Planning Tools (STOA-Intelligence)","ENV-017-AI","FILE:artifacts/sprint0/codex-run/Framework.md;FILE:audit-matrix.yml;POLICY:Sprint 0 complete;ENV:AI analytics ready;FILE:docs/shared/review-checklist.md;FILE:docs/operations/quality-gates.md;FILE:docs/operations/pr-checklist.md;FILE:docs/operations/project-playbook.md;FILE:artifacts/misc/test-orchestration.json","Backlog AI-prioritized, velocity AI-predicted, capacity AI-optimized, risks AI-identified; artifacts: velocity-prediction.json, capacity-model.csv, risk-matrix.md; targets: >=20%","Completed","Delivery metrics dashboard live (lead time, deploy frequency, change failure rate, MTTR); forecast error <= +/-20%","1","ARTIFACT:artifacts/misc/velocity-prediction.json;ARTIFACT:artifacts/misc/capacity-model.csv;ARTIFACT:artifacts/reports/risk-matrix.md;ARTIFACT:artifacts/misc/sprint-planning/README.md;EVIDENCE:artifacts/attestations/ENV-018-AI/context_ack.json","AUDIT:manual-review"
"EP-001-AI","Foundation Setup","EasyPanel Internal Tools Deployment (Push-based OTLP Pipeline)","DevOps + Claude Code (STOA-Automation)","ENV-003-AI,ENV-008-AI","FILE:artifacts/sprint0/codex-run/Framework.md;FILE:audit-matrix.yml;ENV:Server provisioned;ENV:Tailscale or Cloudflare Access configured;ENV:EasyPanel installed;FILE:docs/planning/adr/ADR-006-agent-tools.md;FILE:docs/operations/quality-gates.md;FILE:docs/operations/release-rollback.md;FILE:docker-compose.yml;FILE:artifacts/misc/otel-config.yaml","Week 1: OTel Collector + Prometheus + Grafana deployed behind access control; Week 2: Loki + Tempo deployed with trace-to-log correlation; Week 3: SonarQube deployed with GitHub Actions integration; All configs git-versioned and shared between local Docker and EasyPanel; targets: >=100%, <30 min, zero errors","Completed","Setup <30 min, zero manual SSL config, 100% services behind access control, 30-day metrics/logs retention, 7-day traces retention, OTLP push working from Railway","0","ARTIFACT:infra/monitoring/otel-collector.yaml;ARTIFACT:infra/monitoring/tempo-config.yml;ARTIFACT:infra/monitoring/docker-compose.monitoring.yml;ARTIFACT:infra/monitoring/prometheus.yml;ARTIFACT:infra/monitoring/loki-config.yml;ARTIFACT:artifacts/monitoring-config-hashes.txt;ARTIFACT:docs/operations/monitoring-runbook.md;EVIDENCE:artifacts/attestations/EP-001-AI/context_ack.json","AUDIT:manual-review"
"AUTOMATION-001","AI Foundation","Continuous AI Agent Coordination System","AI Specialist (STOA-Intelligence)","AI-SETUP-001,AI-SETUP-002,ENV-005-AI,ENV-008-AI,ENV-010-AI","FILE:artifacts/sprint0/codex-run/Framework.md;FILE:audit-matrix.yml;ENV:All AI tools integrated;FILE:docs/planning/adr/ADR-006-agent-tools.md;FILE:artifacts/misc/command-test-results.csv;FILE:docs/shared/copilot-instructions.md;FILE:.github/workflows/ci.yml;FILE:artifacts/misc/otel-config.yaml;FILE:artifacts/coverage/index.html","Multi-agent orchestration active, task handoffs automated, quality gates AI-enforced; artifacts: orchestration-config.yaml, handoff-metrics.json, quality-gates.log","Completed","Automated task routing/notifications in place; PR/CI status surfaced; incident alerts to on-call channel","0","ARTIFACT:artifacts/misc/orchestration-config.yaml;ARTIFACT:artifacts/metrics/handoff-metrics.json;ARTIFACT:artifacts/logs/quality-gates.log;ARTIFACT:scripts/swarm/orchestrator.sh;ARTIFACT:scripts/swarm/swarm-manager.sh;ARTIFACT:artifacts/misc/agent-coordination/README.md;ARTIFACT:artifacts/misc/agent-coordination/routing-rules.json;ARTIFACT:artifacts/misc/agents-actions-logs/agent-actions.log;EVIDENCE:artifacts/attestations/AUTOMATION-001/context_ack.json","GATE:coverage-gte-90"
"AUTOMATION-002","AI Foundation","AI Performance Dashboard and Optimization Loop","AI Specialist + Backend Dev (STOA-Intelligence)","AUTOMATION-001","FILE:artifacts/sprint0/codex-run/Framework.md;FILE:audit-matrix.yml;ENV:Metrics collection active;ENV:AI analysis ready;FILE:artifacts/misc/orchestration-config.yaml","Dashboard showing AI impact, optimization suggestions implemented, ROI tracked; artifacts: optimization-loop.yaml, roi-tracking.csv, metrics-realtime.json","Completed","DORA + quality metrics dashboard live; weekly review cadence established; action items tracked to closure","0","ARTIFACT:artifacts/misc/optimization-loop.yaml;ARTIFACT:artifacts/misc/roi-tracking.csv;ARTIFACT:artifacts/metrics/metrics-realtime.json;ARTIFACT:artifacts/misc/ai-dashboard/dashboard-spec.json;ARTIFACT:artifacts/misc/ai-dashboard/README.md;ARTIFACT:artifacts/misc/agent-coordination/README.md;ARTIFACT:artifacts/misc/agent-coordination/routing-rules.json;ARTIFACT:artifacts/misc/agents-actions-logs/agent-actions.log;EVIDENCE:artifacts/attestations/AUTOMATION-002/context_ack.json","AUDIT:manual-review"
"IFC-000","Planning","IntelliFlow CRM Feasibility Assessment","CEO + CTO + CFO (STOA-Leadership)","","FILE:artifacts/sprint0/codex-run/Framework.md;FILE:audit-matrix.yml;POLICY:Leadership alignment complete;POLICY:vision approved","Go/No-Go decision documented with clear rationale; targets: >=80%","Completed","Decision confidence >80%, risks documented","0","ARTIFACT:artifacts/reports/business-case.md;ARTIFACT:artifacts/reports/swot-analysis.md;ARTIFACT:artifacts/reports/financial-model.md;ARTIFACT:docs/planning/ADR-000-feasibility.md;ARTIFACT:artifacts/reports/ifc-000-completion-manifest.json;EVIDENCE:artifacts/attestations/IFC-000/context_ack.json","AUDIT:code-review"
"IFC-001","Validation","PHASE-001: Technical Architecture Spike - Modern Stack","CTO + Tech Lead (STOA-Foundation)","IFC-000","FILE:artifacts/sprint0/codex-run/Framework.md;FILE:audit-matrix.yml;ENV:Turborepo setup;POLICY:tRPC evaluated;ENV:Supabase account;FILE:docs/planning/adr/ADR-001-modern-stack.md;FILE:docs/tdd-guidelines.md;FILE:docs/shared/review-checklist.md;FILE:docs/architecture/decision-workflow.md;FILE:artifacts/reports/business-case.md","Modern stack feasibility proven, ADRs documented; targets: <50ms","Completed","All components connectable, type-safety validated, latency <50ms","1","SPEC:.specify/specifications/IFC-001.md;PLAN:.specify/planning/IFC-001.md;ARTIFACT:artifacts/misc/architecture-spike/README.md;ARTIFACT:artifacts/misc/architecture-spike/performance-test.ts;ARTIFACT:artifacts/misc/architecture-spike/type-safety-validation.ts;ARTIFACT:artifacts/reports/ifc-000-completion-manifest.json;EVIDENCE:artifacts/attestations/IFC-001/context_pack.md;EVIDENCE:artifacts/attestations/IFC-001/context_ack.json;ARTIFACT:docs/planning/adr/ADR-001-modern-stack.md;ARTIFACT:docs/planning/adr/ADR-001-modern-stack.md;ARTIFACT:artifacts/benchmarks/performance-benchmark.json;ARTIFACT:apps/project-tracker/docs/metrics/_global/flows/FLOW-001.md;ARTIFACT:apps/project-tracker/docs/metrics/_global/phase-validations/PHASE-001-validation.md","AUDIT:manual-review"
