Task ID,Section,Description,Owner,Dependencies,Pre-requisites,Definition of Done,Status,KPIs,Target Sprint,Artifacts To Track,Validation Method,Estimate (O/M/P),Planned Start,Planned Finish,Percent Complete,Dependency Types,Cadence
PG-157,Core CRM,Visible Pin to Home buttons on entity list items and detail page headers - not just hidden in 3-dot MoreActionsButton sheet,CRM FE (STOA-Foundation),PG-129,FILE:apps/web/src/components/shared/entity-action-sheet.tsx;FILE:apps/web/src/hooks/use-entity-pin.ts,Pin/Unpin icon button visible on entity detail headers; uses useEntityPin hook; aria-label for a11y; tests cover pin toggle,Completed,"Pin button visible without opening 3-dot menu, WCAG AA compliant",15,ARTIFACT:apps/web/src/components/home/PinButton.tsx,VALIDATE:pnpm --filter @intelliflow/web typecheck;VALIDATE:pnpm --filter @intelliflow/web test --run,30/60/120,2026-02-28,2026-02-28,100,PG-129:FS,
PG-158,Core CRM,Drag and drop pinned items reorder - backend API exists (home.reorderPinnedItems) needs @dnd-kit frontend integration,CRM FE (STOA-Foundation),PG-129,FILE:apps/web/src/components/home/PinnedItemsSheet.tsx;FILE:apps/api/src/modules/home/home.router.ts,@dnd-kit installed; PinnedSection supports drag-and-drop reorder; calls home.reorderPinnedItems on drop; touch support; tests cover reorder,Completed,"Drag-drop reorder works on desktop and mobile, order persists via API",15,ARTIFACT:apps/web/src/components/home/PinnedItemsSheet.tsx;ARTIFACT:apps/web/src/components/home/DraggablePinnedItem.tsx,VALIDATE:pnpm --filter @intelliflow/web typecheck;VALIDATE:pnpm --filter @intelliflow/web test --run,60/120/180,2026-02-28,2026-02-28,100,PG-129:FS,
PG-159,Core CRM,Stale pin handling - deleted or inaccessible pinned entities should show Item unavailable with unpin option,CRM FE+BE (STOA-Foundation),PG-129,FILE:apps/api/src/modules/home/home.router.ts;FILE:apps/web/src/components/home/AuthenticatedHomePage.tsx,getPinnedItems checks entity existence; missing entities return stub with unavailable flag; UI shows badge with unpin button; ADR-027 requirement verified,Completed,"Stale pins show fallback within 200ms, unpin works on stale items",15,ARTIFACT:apps/api/src/modules/home/home.router.ts;ARTIFACT:apps/web/src/components/home/AuthenticatedHomePage.tsx,VALIDATE:pnpm --filter @intelliflow/web test --run;VALIDATE:pnpm --filter @intelliflow/api test --run,30/60/120,2026-02-28,2026-03-01,100,PG-129:FS,
PG-160,Core CRM,View All AI Insights page - /insights route with getAllInsights endpoint pagination and filtering by insight type,CRM FE+BE (STOA-Foundation),PG-129,FILE:apps/api/src/modules/home/home.router.ts,/insights page with paginated list; getAllInsights endpoint with type filter; View All link navigates correctly; loading/empty states,Completed,"Page loads <500ms, supports 4 insight type filters, cursor pagination",15,ARTIFACT:apps/web/src/app/insights/page.tsx;ARTIFACT:apps/web/src/components/insights/InsightsListPage.tsx,VALIDATE:pnpm --filter @intelliflow/web typecheck;VALIDATE:pnpm --filter @intelliflow/web test --run,60/120/180,2026-02-28,2026-03-01,100,PG-129:FS,
PG-161,Core CRM,Notifications integration on home page - bell icon header badge count IFC-183 Prisma model and notification router,CRM FE+BE (STOA-Foundation),"PG-129,IFC-183",FILE:apps/web/src/components/home/AuthenticatedHomePage.tsx,Bell icon in home header; unread count badge; dropdown with recent notifications; mark-as-read; Notification model + router; tests cover bell and badge,Completed,"Badge updates in real-time, mark-read latency <200ms",16,ARTIFACT:apps/web/src/components/notifications/NotificationBell.tsx;ARTIFACT:apps/api/src/modules/notifications/notifications.router.ts;ARTIFACT:apps/web/src/components/home/NotificationsSummaryWidget.tsx,VALIDATE:pnpm --filter @intelliflow/web typecheck;VALIDATE:pnpm --filter @intelliflow/web test --run,120/240/360,2026-03-10,2026-03-11,100,"PG-129:FS,IFC-183:FS",SPEC:.specify/sprints/sprint-16/specifications/PG-161-spec.md;PLAN:.specify/sprints/sprint-16/planning/PG-161-plan.md;EVIDENCE:.specify/sprints/sprint-16/attestations/PG-161/attestation.json
PG-162,Core CRM,AI Insights from ML model - LangChain chain for generating daily insights with caching confidence scores and action recommendations Cross-entity scope: null-state UX - when AI insight is null on entity detail pages show Run AI Analysis button. Lead detail already done (2026-03-04) apply same pattern to Contact detail. Ensure fallback values visually distinct from real AI data.,AI Specialist (STOA-Intelligence),"PG-129,IFC-095",FILE:apps/ai-worker/src/chains/insight-generation.chain.ts;FILE:apps/api/src/modules/home/home.router.ts,LangChain chain generates daily insights per user; cached 1h TTL; confidence scores; 4 insight types; home.getAIInsights reads from cache; tests with mocked LLM; Null-state indicator on Contact detail; fallback data visually distinguished from real AI output,Completed,"Insight generation <3s, cache hit rate >80%, 4 insight types",16,ARTIFACT:apps/api/src/modules/home/home.router.ts;ARTIFACT:apps/web/src/components/insights/InsightCard.tsx;ARTIFACT:apps/web/src/app/contacts/[id]/page.tsx;ARTIFACT:packages/validators/src/home.ts;ARTIFACT:apps/web/src/app/contacts/[id]/__tests__/page.test.tsx,VALIDATE:pnpm --filter @intelliflow/validators exec vitest run src/__tests__/home.test.ts;VALIDATE:pnpm --filter @intelliflow/api exec vitest run src/modules/home/__tests__/home.router.test.ts;VALIDATE:pnpm --filter @intelliflow/web exec vitest run src/components/home/__tests__/AuthenticatedHomePage.test.tsx src/app/insights/__tests__/page.test.tsx src/app/contacts/[id]/__tests__/page.test.tsx,120/240/480,2026-03-10,2026-03-10,100,"PG-129:FS,IFC-095:FS",
PG-163,Core CRM,Home page integration tests - test home.router endpoints against real database with seed data,QA (STOA-Quality),PG-129,FILE:apps/api/src/modules/home/home.router.ts;FILE:apps/api/src/modules/home/__tests__/home.router.coverage.test.ts,"Integration tests for all 9 home router endpoints; mock-based with full middleware chain; covers auth, pagination, error cases; >90% coverage on home.router.ts",Completed,"Coverage >90% on home router, all 9 endpoints tested, <30s suite",15,ARTIFACT:apps/api/src/modules/home/__tests__/home.router.coverage.test.ts;SPEC:.specify/sprints/sprint-15/specifications/PG-163-spec.md;PLAN:.specify/sprints/sprint-15/planning/PG-163-plan.md,VALIDATE:pnpm --filter @intelliflow/api test --run,60/120/240,2026-03-01,2026-03-01,100,PG-129:FS,
PG-164,Core CRM,Home page E2E tests - 5 Playwright scenarios: public page auth redirect insight click quick action pin/unpin flow,QA (STOA-Quality),"PG-129,PG-155",FILE:tests/e2e/home/home-page.spec.ts;FILE:apps/web/src/components/home/AuthenticatedHomePage.tsx,"5 Playwright E2E scenarios passing; covers auth, navigation, interactions; CI integrated; screenshots on failure; <60s total",Completed,"5 E2E scenarios passing, <60s runtime, CI integrated",15,ARTIFACT:tests/e2e/home/home-page.spec.ts;SPEC:.specify/sprints/sprint-15/specifications/PG-164-spec.md;PLAN:.specify/sprints/sprint-15/planning/PG-164-plan.md;ARTIFACT:tests/e2e/global-teardown.ts,VALIDATE:pnpm test:e2e -- --grep home,60/120/240,2026-03-07,2026-03-08,100,"PG-129:FS,PG-155:FS",
PG-165,Core CRM,Update PRD checkboxes for home page - mark completed acceptance criteria and annotate deferred items with task references,Tech Lead (STOA-Foundation),PG-129,FILE:docs/planning/prd-home-page.md,All 51 PRD checkboxes reviewed; 38 completed items marked [x]; 13 deferred items annotated with task references (PG-156 to PG-164); PRD reflects implementation state,Completed,All checkboxes accurately reflect implementation state,14,ARTIFACT:docs/planning/prd-home-page.md,VALIDATE:pnpm --filter @intelliflow/web typecheck;VALIDATE:pnpm --filter @intelliflow/web test --run,15/30/60,2026-02-22,2026-02-23,100,PG-129:FS,
PG-166,Core CRM,Lighthouse audit on authenticated home page - verify NFR targets TTI <1s Performance >=90 Accessibility >=90,QA (STOA-Quality),PG-129,FILE:apps/web/src/components/home/AuthenticatedHomePage.tsx,"Lighthouse CI audit on / route; Performance >=90, Accessibility >=90, TTI <1s; results saved to artifacts; ADR-027 verification confirmed",Completed,"Lighthouse Performance >=90, Accessibility >=90, TTI <1s",19,ARTIFACT:artifacts/benchmarks/home-page-lighthouse.json,VALIDATE:npx lighthouse http://localhost:3000 --output json,30/60/120,2026-09-06,2026-09-08,100,PG-129:FS,
PG-167,Core CRM,Analytics tracking plan for home page - define and implement business metrics events for section interactions,CRM FE (STOA-Foundation),PG-129,FILE:apps/web/src/components/home/AuthenticatedHomePage.tsx,"Analytics events for quick action clicks, insight interactions, feed scrolls, pin/unpin, goal views; tracking utility integrated; event schema documented",Completed,"All 6 home sections emit analytics events, schema documented",16,ARTIFACT:docs/analytics/home-page-tracking-plan.md;ARTIFACT:apps/web/src/lib/analytics.ts;SPEC:.specify/sprints/sprint-16/specifications/PG-167-spec.md;PLAN:.specify/sprints/sprint-16/planning/PG-167-plan.md;ATTESTATION:.specify/sprints/sprint-16/attestations/PG-167/attestation.json,VALIDATE:pnpm --filter @intelliflow/web typecheck,30/60/120,2026-03-10,2026-03-11,100,PG-129:FS,
PG-168,Core CRM,Monitoring and Sentry error tracking for home route - error boundaries breadcrumbs performance spans,CRM FE (STOA-Quality),PG-129,FILE:apps/web/src/components/home/AuthenticatedHomePage.tsx,Sentry error boundary wrapping home sections; breadcrumbs for section loads; performance spans for each tRPC query; error alerts configured,Backlog,"All 6 sections have error boundaries, performance spans for 8 queries",20,ARTIFACT:apps/web/src/components/home/HomeErrorBoundary.tsx,VALIDATE:pnpm --filter @intelliflow/web typecheck;VALIDATE:pnpm --filter @intelliflow/web test --run,30/60/120,,,0,PG-129:FS,
PG-169,Developer Pages,Developer Guides Page,DevRel (STOA-Foundation),PG-032,FILE:apps/web/src/app/(developer)/docs/page.tsx;FILE:docs/docusaurus.config.js;ENV:guides content available,"Response <200ms, Lighthouse >=90, guides listed and categorized; artifacts: page.tsx, guides-list.tsx",Completed,"Guides listed, categorized by topic, links to Docusaurus guides",15,ARTIFACT:apps/web/src/app/(developer)/docs/guides/page.tsx;ARTIFACT:apps/web/src/components/developer/guides-list.tsx;EVIDENCE:.specify/sprints/sprint-15/attestations/PG-169/attestation.json,GATE:lighthouse-gte-90;VALIDATE:pnpm --filter @intelliflow/web typecheck;VALIDATE:pnpm --filter @intelliflow/web test --run,50/120/240,2026-03-01,2026-03-01,100,PG-032:FS,
PG-170,Developer Pages,Architecture Docs Page,DevRel (STOA-Foundation),PG-032,FILE:apps/web/src/app/(developer)/docs/page.tsx;FILE:docs/architecture/adr/README.md;ENV:ADR content exists,"Response <200ms, Lighthouse >=90, ADRs listed and searchable; artifacts: page.tsx, adr-list.tsx",Completed,"Architecture docs indexed, 43 ADRs linked, DDD context map shown",15,ARTIFACT:apps/web/src/app/(developer)/docs/architecture/page.tsx;ARTIFACT:apps/web/src/components/developer/adr-list.tsx;EVIDENCE:.specify/sprints/sprint-15/attestations/PG-170/attestation.json;SPEC:.specify/sprints/sprint-15/specifications/PG-170-spec.md;PLAN:.specify/sprints/sprint-15/planning/PG-170-plan.md,GATE:lighthouse-gte-90;VALIDATE:pnpm --filter @intelliflow/web typecheck;VALIDATE:pnpm --filter @intelliflow/web test --run,50/120/240,2026-03-01,2026-03-01,100,PG-032:FS,
PG-171,Developer Pages,Integration Resources Page,DevRel (STOA-Foundation),"PG-032,PG-034",FILE:apps/web/src/app/(developer)/docs/page.tsx;ENV:webhook docs ready,"Response <200ms, Lighthouse >=90, integrations documented; artifacts: page.tsx, integration-list.tsx",Completed,"Integrations listed, webhook + SDK + auth links working",15,ARTIFACT:apps/web/src/app/(developer)/docs/integrations/page.tsx;ARTIFACT:apps/web/src/components/developer/integration-list.tsx;EVIDENCE:.specify/sprints/sprint-15/attestations/PG-171/attestation.json,GATE:lighthouse-gte-90;VALIDATE:pnpm --filter @intelliflow/web typecheck;VALIDATE:pnpm --filter @intelliflow/web test --run,50/120/240,2026-02-20,2026-02-20,100,"PG-032:FS,PG-034:FS",
PG-172,Billing Pages,Billing Ghost Pages - Usage Plans Upgrade Cancel and Settings,Platform BE (STOA-Foundation),"PG-025,PG-030",IMPLEMENTS:FLOW-048;FILE:docs/planning/prd-billing-portal.md;FILE:docs/architecture/adr/ADR-029-billing-architecture.md;FILE:.specify/memory/Framework.md;FILE:audit-matrix.yml;FILE:apps/web/src/components/sidebar/configs/billing.ts;FILE:apps/web/src/components/billing/billing-portal.tsx;FILE:docs/design/navigation-reachability-audit.md;DESIGN:docs/design/mockups/billing-portal.png,Pages at /billing/usage (usage metrics vs plan limits with progress bars) /billing/plans (3-tier comparison grid Starter/Professional/Enterprise) /billing/upgrade (proration preview and confirmation) /billing/cancel (retention offer reason selection period-end behaviour) /billing/settings (billing address contact tax fields); all sidebar and billing-portal.tsx in-page links resolve; Lighthouse >=90; tests passing; verified by: pnpm test,Completed,All 5 billing ghost routes resolve; usage bars accurate; upgrade shows proration; cancel period-end confirmed; Lighthouse >=90,16,ARTIFACT:apps/web/src/app/billing/usage/page.tsx;ARTIFACT:apps/web/src/app/billing/plans/page.tsx;ARTIFACT:apps/web/src/app/billing/upgrade/page.tsx;ARTIFACT:apps/web/src/app/billing/cancel/page.tsx;ARTIFACT:apps/web/src/app/billing/settings/page.tsx;ARTIFACT:apps/web/src/components/billing/usage-dashboard.tsx;ARTIFACT:apps/web/src/components/billing/plan-comparison.tsx;ARTIFACT:apps/web/src/components/billing/upgrade-flow.tsx;ARTIFACT:apps/web/src/components/billing/cancel-flow.tsx;ARTIFACT:apps/web/src/components/billing/__tests__/usage-dashboard.test.tsx;ARTIFACT:apps/web/src/components/billing/__tests__/plan-comparison.test.tsx;ARTIFACT:apps/web/src/components/billing/__tests__/upgrade-flow.test.tsx;ARTIFACT:apps/web/src/components/billing/__tests__/cancel-flow.test.tsx;ARTIFACT:apps/web/src/components/billing/__tests__/billing-settings.test.tsx;ARTIFACT:apps/web/src/components/billing/billing-shared.tsx;ARTIFACT:apps/web/src/components/billing/billing-settings.tsx;EVIDENCE:.specify/sprints/sprint-16/attestations/PG-172/attestation.json;EVIDENCE:.specify/sprints/sprint-16/attestations/PG-172/attestation.json;SPEC:.specify/sprints/sprint-16/specifications/PG-172-spec.md;PLAN:.specify/sprints/sprint-16/planning/PG-172-plan.md,GATE:lighthouse-gte-90;VALIDATE:pnpm test,180/360/720,2026-03-10,2026-03-10,100,"PG-025:FS,PG-030:FS",
PG-173,Support,Ticket Configuration Pages - SLA Policies Types and Automations,Frontend Dev (STOA-Domain),"PG-137,IFC-189,IFC-093",FILE:apps/web/src/components/sidebar/configs/tickets.ts;FILE:apps/api/src/modules/ticket/ticket.router.ts;FILE:packages/domain/src/crm/ticket/Ticket.ts;FILE:packages/domain/src/support/TicketConstants.ts;FILE:.specify/memory/Framework.md;FILE:audit-matrix.yml;FILE:docs/design/navigation-reachability-audit.md;DESIGN:docs/design/mockups/tickets-config.png,Pages at /tickets/sla-policies (SLA rule list with priority and time targets CRUD) /tickets/types (ticket category list with custom field definitions) /tickets/automations (trigger-condition-action rule builder for auto-assignment and status transitions); sidebar Configuration section links resolve; Lighthouse >=90; verified by: pnpm test,Completed,All 3 ticket config routes resolve; SLA rules CRUD working; types editable; automations rule engine renders; 96 total tests pass (57 frontend + 16 backend + 23 validators),16,ARTIFACT:apps/web/src/app/tickets/(list)/sla-policies/page.tsx;ARTIFACT:apps/web/src/app/tickets/types/page.tsx;ARTIFACT:apps/web/src/app/tickets/automations/page.tsx;ARTIFACT:apps/web/src/components/tickets/SLAPolicyManager.tsx;ARTIFACT:apps/web/src/components/tickets/TicketTypeManager.tsx;ARTIFACT:apps/web/src/components/tickets/AutomationRuleBuilder.tsx;ARTIFACT:apps/web/src/components/tickets/ticket-config-shared.tsx;ARTIFACT:apps/web/src/components/tickets/__tests__/SLAPolicyManager.test.tsx;ARTIFACT:apps/web/src/components/tickets/__tests__/TicketTypeManager.test.tsx;ARTIFACT:apps/web/src/components/tickets/__tests__/AutomationRuleBuilder.test.tsx;ARTIFACT:packages/validators/src/sla-policy.ts;ARTIFACT:packages/validators/src/ticket-category.ts;ARTIFACT:packages/validators/src/__tests__/ticket-config-validators.test.ts;ARTIFACT:apps/api/src/modules/ticket/ticket-config.router.ts;ARTIFACT:apps/api/src/modules/ticket/__tests__/ticket-config.router.test.ts;EVIDENCE:.specify/sprints/sprint-16/attestations/PG-173/attestation.json;SPEC:.specify/sprints/sprint-16/specifications/PG-173-spec.md;PLAN:.specify/sprints/sprint-16/planning/PG-173-plan.md,GATE:lighthouse-gte-90;VALIDATE:pnpm test,120/240/480,2026-03-10,2026-03-10,100,"PG-137:FS,IFC-189:FS,IFC-093:FS",
PG-174,Notifications,Notification Configuration Pages - Channels and Quiet Hours,Frontend Dev (STOA-Domain),IFC-157,FILE:apps/web/src/components/sidebar/configs/notifications.ts;FILE:apps/web/src/app/notifications/settings/page.tsx;FILE:.specify/memory/Framework.md;FILE:audit-matrix.yml;FILE:docs/design/navigation-reachability-audit.md;DESIGN:docs/design/mockups/notifications-config.png,Pages at /notifications/channels (delivery channel list with enable/disable toggles and per-channel config for email SMS push webhook) and /notifications/quiet-hours (weekly schedule grid with time-range pickers and day selectors for suppression windows); sidebar Configuration links resolve; Lighthouse >=90; verified by: pnpm test,Completed,Both notification config routes resolve; channels enable/disable toggles; quiet-hours schedule saves; Lighthouse >=90,16,ARTIFACT:apps/web/src/app/notifications/channels/page.tsx;ARTIFACT:apps/web/src/app/notifications/quiet-hours/page.tsx;ARTIFACT:apps/web/src/components/notifications/ChannelManager.tsx;ARTIFACT:apps/web/src/components/notifications/QuietHoursScheduler.tsx;ARTIFACT:apps/web/src/components/notifications/__tests__/ChannelManager.test.tsx;ARTIFACT:apps/web/src/components/notifications/__tests__/QuietHoursScheduler.test.tsx;SPEC:.specify/sprints/sprint-16/specifications/PG-174-spec.md;EVIDENCE:.specify/sprints/sprint-16/attestations/PG-174/attestation.json,GATE:lighthouse-gte-90;VALIDATE:pnpm test,90/180/360,2026-03-10,2026-03-12,100,IFC-157:FS,
PG-175,Core CRM,Deals Trash Page - Soft-deleted deals list with restore and permanent delete,Frontend Dev (STOA-Domain),PG-135,FILE:apps/web/src/components/sidebar/configs/deals.ts;FILE:apps/api/src/modules/opportunity/opportunity.router.ts;FILE:packages/adapters/src/repositories/PrismaOpportunityRepository.ts;FILE:.specify/memory/Framework.md;FILE:audit-matrix.yml;FILE:docs/design/navigation-reachability-audit.md,Page at /deals/trash showing soft-deleted deals list with deal name value stage-at-deletion date; restore action (reverts deletedAt) and permanent delete with confirmation dialog; follows /deals data-table pattern; sidebar trash link resolves; Lighthouse >=90; verified by: pnpm test,Completed,Deals trash page resolves; restore working; permanent delete with confirm dialog; data-table pattern; Lighthouse >=90,16,ARTIFACT:apps/web/src/app/deals/(list)/trash/page.tsx;ARTIFACT:apps/web/src/components/deals/TrashList.tsx;ARTIFACT:apps/web/src/components/deals/__tests__/TrashList.test.tsx;EVIDENCE:.specify/sprints/sprint-16/attestations/PG-175/attestation.json;SPEC:.specify/sprints/sprint-16/specifications/PG-175-spec.md;PLAN:.specify/sprints/sprint-16/planning/PG-175-plan.md,GATE:lighthouse-gte-90;VALIDATE:pnpm test,60/120/240,2026-03-18,,100,PG-135:FS,
PG-176,Governance,Governance Quality Report Sub-Pages - Lighthouse Coverage and Performance views,Frontend Dev (STOA-Quality),PG-015,FILE:apps/web/src/components/sidebar/configs/governance.ts;FILE:apps/web/src/app/governance/quality-reports/page.tsx;FILE:.specify/memory/Framework.md;FILE:audit-matrix.yml;FILE:docs/design/navigation-reachability-audit.md;DESIGN:docs/design/mockups/quality-reports-detail.png,Pages at /governance/quality-reports/lighthouse (Lighthouse scores by URL with category breakdown and historical trend) /governance/quality-reports/coverage (test coverage by package with statements branches functions lines) /governance/quality-reports/performance (API response time and load test results); each renders focused report type with back-link to quality-reports list; sidebar Quality links resolve; Lighthouse >=90; verified by: pnpm test,Completed,All 3 quality report sub-routes resolve; each shows focused report data; back-navigation works; Lighthouse >=90,16,ARTIFACT:apps/web/src/app/governance/quality-reports/lighthouse/page.tsx;ARTIFACT:apps/web/src/app/governance/quality-reports/coverage/page.tsx;ARTIFACT:apps/web/src/app/governance/quality-reports/performance/page.tsx;ARTIFACT:apps/web/src/components/governance/LighthouseReportView.tsx;ARTIFACT:apps/web/src/components/governance/CoverageReportView.tsx;ARTIFACT:apps/web/src/components/governance/PerformanceReportView.tsx;ARTIFACT:apps/web/src/components/governance/__tests__/LighthouseReportView.test.tsx;ARTIFACT:apps/web/src/components/governance/__tests__/CoverageReportView.test.tsx;ARTIFACT:apps/web/src/components/governance/__tests__/PerformanceReportView.test.tsx;EVIDENCE:.specify/sprints/sprint-16/attestations/PG-176/attestation.json;SPEC:.specify/sprints/sprint-16/specifications/PG-176-spec.md;PLAN:.specify/sprints/sprint-16/planning/PG-176-plan.md,GATE:lighthouse-gte-90;VALIDATE:pnpm test,90/180/360,2026-03-15,,100,PG-015:FS,
PG-177,Analytics,Analytics Saved Report Pages - Weekly Monthly and Quarterly views,Frontend Dev (STOA-Foundation),IFC-068,FILE:apps/web/src/components/sidebar/configs/analytics.ts;FILE:apps/web/src/app/analytics/(list)/page.tsx;FILE:.specify/memory/Framework.md;FILE:audit-matrix.yml;FILE:docs/design/navigation-reachability-audit.md;DESIGN:docs/design/mockups/analytics-saved-reports.png,Pages at /analytics/saved/weekly (last 7 days metrics: revenue leads tickets closed with trend indicators) /analytics/saved/monthly (last 30 days revenue breakdown by product and region) /analytics/saved/quarterly (Q4 performance summary with YoY comparison); sidebar Saved Reports links resolve; Lighthouse >=90; verified by: pnpm test,Completed,All 3 saved report routes resolve; weekly/monthly/quarterly data renders; period selector works; Lighthouse >=90,16,ARTIFACT:apps/web/src/app/analytics/(list)/saved/weekly/page.tsx;ARTIFACT:apps/web/src/app/analytics/(list)/saved/monthly/page.tsx;ARTIFACT:apps/web/src/app/analytics/(list)/saved/quarterly/page.tsx;ARTIFACT:apps/web/src/components/analytics/SavedReportView.tsx;ARTIFACT:apps/web/src/components/analytics/__tests__/SavedReportView.test.tsx;EVIDENCE:.specify/sprints/sprint-16/attestations/PG-177/attestation.json,GATE:lighthouse-gte-90;VALIDATE:pnpm test,90/180/360,2026-03-16,2026-03-16,100,IFC-068:FS,
PG-178,Settings,Module Settings Pages - 11 per-module configuration pages at /settings/[module],Frontend Dev (STOA-Foundation),"PG-104,IFC-076",FILE:apps/web/src/components/sidebar/configs/leads.ts;FILE:apps/web/src/components/sidebar/configs/contacts.ts;FILE:apps/web/src/components/sidebar/configs/accounts.ts;FILE:apps/web/src/components/sidebar/configs/deals.ts;FILE:apps/web/src/components/sidebar/configs/tickets.ts;FILE:apps/web/src/components/sidebar/configs/documents.ts;FILE:apps/web/src/components/sidebar/configs/analytics.ts;FILE:apps/web/src/components/sidebar/configs/appointments.ts;FILE:apps/web/src/components/sidebar/configs/cases.ts;FILE:apps/web/src/components/sidebar/configs/tasks.ts;FILE:apps/web/src/components/ModulePaywall.tsx;FILE:apps/web/src/app/settings/account/page.tsx;FILE:.specify/memory/Framework.md;FILE:audit-matrix.yml;FILE:docs/design/navigation-reachability-audit.md;DESIGN:docs/design/mockups/module-settings.png;DESIGN:docs/design/mockups/lead-settings.html;DESIGN:docs/design/mockups/lead-settings.png,Pages at /settings/leads (scoring thresholds assignment auto-qual) /settings/contacts (duplicate detection required fields tags) /settings/accounts (hierarchy industry custom fields) /settings/deals (pipeline stages win-loss reasons scoring) /settings/tickets (default SLA auto-close notification triggers) /settings/documents (file types size limits antivirus retention) /settings/reports (default range currency scheduled delivery) /settings/billing (billing address tax ID invoice contact) /settings/appointments (duration buffer calendar integration) /settings/cases (case prefix default priority auto-assign) /settings/tasks (due-date offset reminder templates); all settingsHref and ModulePaywall links resolve; follows settings/account pattern; Lighthouse >=90; verified by: pnpm test,Completed,All 11 module settings routes resolve; form fields render and save; breadcrumb navigation works; Lighthouse >=90,16,ARTIFACT:apps/web/src/app/settings/leads/page.tsx;ARTIFACT:apps/web/src/app/settings/leads/LeadSettingsContent.tsx;ARTIFACT:apps/web/src/app/settings/leads/components/LeadStagesTab.tsx;ARTIFACT:apps/web/src/app/settings/leads/components/ScoringRulesTab.tsx;ARTIFACT:apps/web/src/app/settings/leads/components/CustomFieldsTab.tsx;ARTIFACT:apps/web/src/app/settings/leads/components/AutomationTab.tsx;ARTIFACT:apps/web/src/components/settings/ModuleSettingsLayout.tsx;ARTIFACT:apps/web/src/components/settings/__tests__/ModuleSettingsLayout.test.tsx;ARTIFACT:apps/api/src/modules/lead/lead-settings.router.ts;ARTIFACT:packages/validators/src/lead-settings.ts;EVIDENCE:.specify/sprints/sprint-16/attestations/PG-178/attestation.json,GATE:lighthouse-gte-90;VALIDATE:pnpm test,240/480/960,2026-03-11,2026-03-11,100,"PG-104:FS,IFC-076:FS",SPEC:.specify/sprints/sprint-16/specifications/PG-178-spec.md;PLAN:.specify/sprints/sprint-16/planning/PG-178-plan.md
