"Task ID","Section","Description","Owner","Dependencies","Pre-requisites","Definition of Done","Status","KPIs","Target Sprint","Artifacts To Track","Validation Method"
"PG-114","Settings","Webhooks","Platform FE+BE (STOA-Foundation)","IFC-099","FILE:artifacts/sprint0/codex-run/Framework.md;FILE:audit-matrix.yml;ENV:Webhook config;ENV:testing;FILE:artifacts/misc/connector-status-dashboard.json;FILE:docs/design/sitemap.md;FILE:docs/design/ui-flow-mapping.md;FILE:docs/design/page-registry.md;FILE:apps/project-tracker/docs/metrics/_global/flows/flow-index.md","Response <200ms, Lighthouse ≥90, webhooks firing; artifacts: page.tsx, webhook-config.tsx, webhook-tester.ts; verified by: pnpm test","Backlog","Webhooks configured, testing enabled, logs available","27","ARTIFACT:apps/web/app/(settings)/settings/webhooks/page.tsx;ARTIFACT:apps/web/components/shared/webhook-config.tsx;ARTIFACT:apps/web/lib/shared/webhook-tester.ts;EVIDENCE:artifacts/attestations/PG-114/context_ack.json","VALIDATE:pnpm test;GATE:lighthouse-gte-90"
"PG-115","Settings","Integrations","Platform FE+BE (STOA-Foundation)","IFC-099","FILE:artifacts/sprint0/codex-run/Framework.md;FILE:audit-matrix.yml;ENV:Integration catalog;ENV:OAuth;FILE:artifacts/misc/connector-status-dashboard.json;FILE:docs/design/sitemap.md;FILE:docs/design/ui-flow-mapping.md;FILE:docs/design/page-registry.md;FILE:apps/project-tracker/docs/metrics/_global/flows/flow-index.md","Response <200ms, Lighthouse ≥90, integrations connected; artifacts: page.tsx, integration-catalog.tsx, oauth-handler.ts; verified by: pnpm test:integration","Backlog","Integrations listed, OAuth working, sync active","27","ARTIFACT:apps/web/app/(settings)/settings/integrations/page.tsx;ARTIFACT:apps/web/components/shared/integration-catalog.tsx;ARTIFACT:apps/web/lib/shared/oauth-handler.ts;EVIDENCE:artifacts/attestations/PG-115/context_ack.json","VALIDATE:pnpm test:integration;GATE:lighthouse-gte-90"
"PG-116","Settings","Notifications","Platform FE+BE (STOA-Foundation)","PG-104","FILE:artifacts/sprint0/codex-run/Framework.md;FILE:audit-matrix.yml;ENV:Notification preferences;ENV:channels;FILE:apps/web/app/(settings)/settings/page.tsx;FILE:docs/design/sitemap.md;FILE:docs/design/ui-flow-mapping.md;FILE:docs/design/page-registry.md;FILE:apps/project-tracker/docs/metrics/_global/flows/flow-index.md","Response <200ms, Lighthouse ≥90, preferences saved; artifacts: page.tsx, notification-prefs.tsx, channel-config.ts","Backlog","Preferences set, channels configured, delivery working","27","ARTIFACT:apps/web/app/(settings)/settings/notifications/page.tsx;ARTIFACT:apps/web/components/notifications/notification-prefs.tsx;ARTIFACT:apps/web/lib/notifications/channel-config.ts;EVIDENCE:artifacts/attestations/PG-116/context_ack.json","AUDIT:manual-review;GATE:lighthouse-gte-90"
"PG-117","Settings","Localization","Platform FE+BE (STOA-Foundation)","PG-104","FILE:artifacts/sprint0/codex-run/Framework.md;FILE:audit-matrix.yml;ENV:Language settings;ENV:translations;FILE:apps/web/app/(settings)/settings/page.tsx;FILE:docs/design/sitemap.md;FILE:docs/design/ui-flow-mapping.md;FILE:docs/design/page-registry.md;FILE:apps/project-tracker/docs/metrics/_global/flows/flow-index.md","Response <200ms, Lighthouse ≥90, languages switched; artifacts: page.tsx, language-selector.tsx, translation-manager.ts","Backlog","Languages configured, translations loaded, switching smooth","27","ARTIFACT:apps/web/app/(settings)/settings/localization/page.tsx;ARTIFACT:apps/web/components/shared/language-selector.tsx;ARTIFACT:apps/web/lib/shared/translation-manager.ts;EVIDENCE:artifacts/attestations/PG-117/context_ack.json","AUDIT:manual-review;GATE:lighthouse-gte-90"
"PG-118","Settings","Data Retention","Platform FE+BE (STOA-Foundation)","IFC-058","FILE:artifacts/sprint0/codex-run/Framework.md;FILE:audit-matrix.yml;ENV:Retention policies;ENV:automation;FILE:docs/planning/adr/ADR-007-data-governance.md;FILE:artifacts/reports/gdpr-compliance-checklist.xlsx;FILE:docs/design/sitemap.md;FILE:docs/design/ui-flow-mapping.md;FILE:docs/design/page-registry.md;FILE:apps/project-tracker/docs/metrics/_global/flows/flow-index.md","Response <200ms, Lighthouse ≥90, policies enforced; artifacts: page.tsx, retention-policy.tsx, data-purger.ts","Backlog","Policies configured, automation working, compliance met","28","ARTIFACT:apps/web/app/(settings)/settings/data-retention/page.tsx;ARTIFACT:apps/web/components/shared/retention-policy.tsx;ARTIFACT:apps/web/lib/shared/data-purger.ts;EVIDENCE:artifacts/attestations/PG-118/context_ack.json","AUDIT:manual-review;GATE:lighthouse-gte-90"
"PG-119","Settings","Compliance","Platform FE+BE (STOA-Foundation)","IFC-058","FILE:artifacts/sprint0/codex-run/Framework.md;FILE:audit-matrix.yml;ENV:Compliance dashboard;ENV:reports;FILE:docs/planning/adr/ADR-008-audit-logging.md;FILE:artifacts/reports/gdpr-compliance-checklist.xlsx;FILE:docs/design/sitemap.md;FILE:docs/design/ui-flow-mapping.md;FILE:docs/design/page-registry.md;FILE:apps/project-tracker/docs/metrics/_global/flows/flow-index.md","Response <200ms, Lighthouse ≥90, compliance tracked; artifacts: page.tsx, compliance-dashboard.tsx, audit-reporter.ts","Backlog","Dashboard live, reports generated, audits passed","28","ARTIFACT:apps/web/app/(settings)/settings/compliance/page.tsx;ARTIFACT:apps/web/components/shared/compliance-dashboard.tsx;ARTIFACT:apps/web/lib/shared/audit-reporter.ts;EVIDENCE:artifacts/attestations/PG-119/context_ack.json","AUDIT:manual-review;GATE:lighthouse-gte-90"
"PG-120","Settings","Security","Platform FE+BE (STOA-Foundation)","IFC-072","FILE:artifacts/sprint0/codex-run/Framework.md;FILE:audit-matrix.yml;ENV:Security settings;ENV:2FA config;FILE:docs/security/zero-trust-design.md;FILE:docs/design/sitemap.md;FILE:docs/design/ui-flow-mapping.md;FILE:docs/design/page-registry.md;FILE:apps/project-tracker/docs/metrics/_global/flows/flow-index.md","Response <200ms, Lighthouse ≥90, security enforced; artifacts: page.tsx, security-config.tsx, 2fa-manager.ts","Backlog","Settings configured, 2FA working, policies enforced","28","ARTIFACT:apps/web/app/(settings)/settings/security/page.tsx;ARTIFACT:apps/web/components/security/security-config.tsx;ARTIFACT:apps/web/lib/security/2fa-manager.ts;EVIDENCE:artifacts/attestations/PG-120/context_ack.json","AUDIT:manual-review;GATE:lighthouse-gte-90;AUDIT:security-review"
"PG-121","Settings","Import/Export","Platform FE+BE (STOA-Foundation)","IFC-070","FILE:artifacts/sprint0/codex-run/Framework.md;FILE:audit-matrix.yml;ENV:Data import/export tools;FILE:artifacts/reports/data-validation-report.csv;FILE:docs/design/sitemap.md;FILE:docs/design/ui-flow-mapping.md;FILE:docs/design/page-registry.md;FILE:apps/project-tracker/docs/metrics/_global/flows/flow-index.md","Response <200ms, Lighthouse ≥90, transfers working; artifacts: page.tsx, data-importer.tsx, data-exporter.ts","Backlog","Imports processed, exports generated, mappings saved","28","ARTIFACT:apps/web/app/(settings)/settings/import-export/page.tsx;ARTIFACT:apps/web/components/shared/data-importer.tsx;ARTIFACT:apps/web/lib/shared/data-exporter.ts;EVIDENCE:artifacts/attestations/PG-121/context_ack.json","AUDIT:manual-review;GATE:lighthouse-gte-90"
"PG-122","Settings","Privacy Export","Platform FE+BE (STOA-Foundation)","IFC-058","FILE:artifacts/sprint0/codex-run/Framework.md;FILE:audit-matrix.yml;ENV:GDPR export;ENV:data packages;FILE:docs/shared/review-checklist.md;FILE:docs/operations/pr-checklist.md;FILE:artifacts/reports/gdpr-compliance-checklist.xlsx;FILE:docs/design/sitemap.md;FILE:docs/design/ui-flow-mapping.md;FILE:docs/design/page-registry.md;FILE:apps/project-tracker/docs/metrics/_global/flows/flow-index.md","Response <200ms, Lighthouse ≥90, exports compliant; artifacts: page.tsx, privacy-exporter.tsx, gdpr-packager.ts","Backlog","Exports generated, packages complete, GDPR compliant","28","ARTIFACT:apps/web/app/(settings)/settings/privacy/export/page.tsx;ARTIFACT:apps/web/components/shared/privacy-exporter.tsx;ARTIFACT:apps/web/lib/shared/gdpr-packager.ts;EVIDENCE:artifacts/attestations/PG-122/context_ack.json","AUDIT:manual-review;GATE:lighthouse-gte-90"
"PG-123","Settings","Privacy Delete","Platform FE+BE (STOA-Foundation)","IFC-058","FILE:artifacts/sprint0/codex-run/Framework.md;FILE:audit-matrix.yml;ENV:Right to erasure;ENV:confirmation;FILE:docs/shared/review-checklist.md;FILE:docs/operations/pr-checklist.md;FILE:artifacts/reports/gdpr-compliance-checklist.xlsx;FILE:docs/design/sitemap.md;FILE:docs/design/ui-flow-mapping.md;FILE:docs/design/page-registry.md;FILE:apps/project-tracker/docs/metrics/_global/flows/flow-index.md","Response <200ms, Lighthouse ≥90, deletion complete; artifacts: page.tsx, data-eraser.tsx, deletion-audit.ts","Backlog","Deletion working, confirmation required, audit logged","28","ARTIFACT:apps/web/app/(settings)/settings/privacy/delete/page.tsx;ARTIFACT:apps/web/components/shared/data-eraser.tsx;ARTIFACT:apps/web/lib/shared/deletion-audit.ts;EVIDENCE:artifacts/attestations/PG-123/context_ack.json","AUDIT:manual-review;GATE:lighthouse-gte-90"
"IFC-101","Validation","PHASE-039: Lead Aggregate and Value Objects","Backend Dev + Tech Lead (STOA-Domain)","IFC-002","FILE:artifacts/sprint0/codex-run/Framework.md;FILE:audit-matrix.yml;POLICY:Bounded contexts defined;POLICY:IFC-002 completed;FILE:docs/planning/DDD-context-map.puml;FILE:packages/db/prisma/schema.prisma;FILE:docs/tdd-guidelines.md;FILE:docs/shared/review-checklist.md;FILE:docs/operations/quality-gates.md","Lead aggregate, value objects, repository interfaces and domain services implemented; artifacts: PrismaLeadRepository.ts, context_ack.json; targets: >=90%; verified by: pnpm test, pnpm test:integration","Completed","Design approved, unit tests ≥90% coverage, repository API stable","2","ARTIFACT:packages/adapters/src/repositories/PrismaLeadRepository.ts;ARTIFACT:apps/project-tracker/docs/metrics/_global/phase-validations/PHASE-039-validation.md;EVIDENCE:artifacts/attestations/IFC-101/context_ack.json","VALIDATE:pnpm test;VALIDATE:pnpm test:integration;AUDIT:design-review;AUDIT:code-review"
"IFC-102","Validation","PHASE-039: Contact Aggregate and Value Objects","Backend Dev + Tech Lead (STOA-Domain)","IFC-002","IMPLEMENTS:FLOW-021;FILE:artifacts/sprint0/codex-run/Framework.md;FILE:audit-matrix.yml;POLICY:Bounded contexts defined;POLICY:IFC-002 completed;FILE:docs/planning/DDD-context-map.puml;FILE:packages/db/prisma/schema.prisma;FILE:docs/tdd-guidelines.md;FILE:docs/shared/review-checklist.md;FILE:docs/operations/quality-gates.md","Contact aggregate implemented with value objects, repository, domain services; artifacts: PrismaContactRepository.ts, context_ack.json; targets: >=90%; verified by: pnpm test","Completed","Design approved, unit tests ≥90% coverage, repository API stable","2","ARTIFACT:packages/adapters/src/repositories/PrismaContactRepository.ts;ARTIFACT:apps/project-tracker/docs/metrics/_global/phase-validations/PHASE-039-validation.md;EVIDENCE:artifacts/attestations/IFC-102/context_ack.json","VALIDATE:pnpm test;AUDIT:design-review;AUDIT:code-review"
"IFC-103","Validation","PHASE-039: Account Aggregate and Value Objects","Backend Dev + Tech Lead (STOA-Domain)","IFC-002","FILE:artifacts/sprint0/codex-run/Framework.md;FILE:audit-matrix.yml;POLICY:Bounded contexts defined;POLICY:IFC-002 completed;FILE:docs/planning/DDD-context-map.puml;FILE:packages/db/prisma/schema.prisma;FILE:docs/tdd-guidelines.md;FILE:docs/shared/review-checklist.md;FILE:docs/operations/quality-gates.md","Account aggregate implemented with value objects, repository, domain services; artifacts: PrismaAccountRepository.ts, context_ack.json; targets: >=90%; verified by: pnpm test","Completed","Design approved, unit tests ≥90% coverage, repository API stable","2","ARTIFACT:packages/adapters/src/repositories/PrismaAccountRepository.ts;ARTIFACT:apps/project-tracker/docs/metrics/_global/phase-validations/PHASE-039-validation.md;EVIDENCE:artifacts/attestations/IFC-103/context_ack.json","VALIDATE:pnpm test;AUDIT:design-review;AUDIT:code-review"
"IFC-104","Validation","PHASE-039: Opportunity Aggregate and Value Objects","Backend Dev + Tech Lead (STOA-Domain)","IFC-002","IMPLEMENTS:FLOW-008;FILE:artifacts/sprint0/codex-run/Framework.md;FILE:audit-matrix.yml;POLICY:Bounded contexts defined;POLICY:IFC-002 completed;FILE:docs/planning/DDD-context-map.puml;FILE:packages/db/prisma/schema.prisma;FILE:docs/tdd-guidelines.md;FILE:docs/shared/review-checklist.md;FILE:docs/operations/quality-gates.md","Opportunity aggregate implemented with value objects, repository, domain services; artifacts: PrismaOpportunityRepository.ts, context_ack.json; targets: >=90%; verified by: pnpm test","Completed","Design approved, unit tests ≥90% coverage, repository API stable","3","ARTIFACT:packages/adapters/src/repositories/PrismaOpportunityRepository.ts;ARTIFACT:apps/project-tracker/docs/metrics/_global/phase-validations/PHASE-039-validation.md;EVIDENCE:artifacts/attestations/IFC-104/context_ack.json","VALIDATE:pnpm test;AUDIT:design-review;AUDIT:code-review"
"IFC-105","Validation","PHASE-039: Task Aggregate and Value Objects","Backend Dev + Tech Lead (STOA-Domain)","IFC-002","FILE:artifacts/sprint0/codex-run/Framework.md;FILE:audit-matrix.yml;POLICY:Bounded contexts defined;POLICY:IFC-002 completed;FILE:docs/planning/DDD-context-map.puml;FILE:packages/db/prisma/schema.prisma;FILE:docs/tdd-guidelines.md;FILE:docs/shared/review-checklist.md;FILE:docs/operations/quality-gates.md","Task aggregate implemented with value objects, repository, domain services; artifacts: PrismaTaskRepository.ts, context_ack.json; targets: >=90%; verified by: pnpm test","Completed","Design approved, unit tests ≥90% coverage, repository API stable","3","ARTIFACT:packages/adapters/src/repositories/PrismaTaskRepository.ts;ARTIFACT:apps/project-tracker/docs/metrics/_global/phase-validations/PHASE-039-validation.md;EVIDENCE:artifacts/attestations/IFC-105/context_ack.json","VALIDATE:pnpm test;AUDIT:design-review;AUDIT:code-review"
"IFC-106","Architecture","PHASE-039: Define Hexagonal module boundaries + create canonical packages/application + packages/adapters skeleton","Tech Lead + Backend Dev (STOA-Domain)","IFC-002","FILE:artifacts/sprint0/codex-run/Framework.md;FILE:audit-matrix.yml;ENV:Domain model for all entities implemented;FILE:docs/architecture/hex-boundaries.md;FILE:docs/architecture/repo-layout.md;FILE:docs/planning/DDD-context-map.puml;FILE:packages/db/prisma/schema.prisma","Application layer created (ports + use-cases); adapters layer created; module boundary rules enforced in CI; architecture tests passing; ADR updated; artifacts: hex-boundaries.md, repo-layout.md, context_ack.json; targets: >=100%","Completed","No domain code depends on infrastructure, 100% adapters tested","1","ARTIFACT:docs/architecture/hex-boundaries.md;ARTIFACT:docs/architecture/repo-layout.md;ARTIFACT:apps/project-tracker/docs/metrics/_global/phase-validations/PHASE-039-validation.md;EVIDENCE:artifacts/attestations/IFC-106/context_ack.json","VALIDATE:pnpm test;AUDIT:code-review"
"IFC-107","Infrastructure","PHASE-039: Implement Repositories and Factories","Backend Dev (STOA-Domain)","IFC-101,IFC-102,IFC-103,IFC-104,IFC-105","FILE:artifacts/sprint0/codex-run/Framework.md;FILE:audit-matrix.yml;ENV:Domain models implemented;FILE:packages/adapters/src/repositories/PrismaLeadRepository.ts;FILE:packages/adapters/src/repositories/PrismaContactRepository.ts;FILE:packages/adapters/src/repositories/PrismaAccountRepository.ts;FILE:packages/adapters/src/repositories/PrismaOpportunityRepository.ts;FILE:packages/adapters/src/repositories/PrismaTaskRepository.ts","Repository implementations for all aggregates with Prisma, factories for entity creation; artifacts: context_ack.json; targets: >=90%; verified by: pnpm test, pnpm test:unit","Completed","Repositories integrated with Prisma, tests coverage >90%","3","ARTIFACT:apps/project-tracker/docs/metrics/_global/phase-validations/PHASE-039-validation.md;EVIDENCE:artifacts/attestations/IFC-107/context_ack.json","VALIDATE:pnpm test;VALIDATE:pnpm test:unit;GATE:coverage-gte-90"
"IFC-108","Validation","Implement Domain Services & Business Logic","Backend Dev (STOA-Domain)","IFC-107","FILE:artifacts/sprint0/codex-run/Framework.md;FILE:audit-matrix.yml;ENV:Domain models and repositories implemented;FILE:docs/architecture/hex-boundaries.md;FILE:docs/planning/DDD-context-map.puml;FILE:docs/tdd-guidelines.md;FILE:docs/shared/review-checklist.md","Domain services implemented for leads, contacts, accounts, opportunities, tasks; artifacts: context_ack.json; targets: >=90%; verified by: pnpm test, pnpm test:integration","Completed","All business rules enforced, 90% test coverage","4","EVIDENCE:artifacts/attestations/IFC-108/context_ack.json","VALIDATE:pnpm test;VALIDATE:pnpm test:integration"
"IFC-109","Testing","Define TDD Process, Coverage & Review Checklist","QA Lead + Tech Lead (STOA-Quality)","IFC-002","FILE:artifacts/sprint0/codex-run/Framework.md;FILE:audit-matrix.yml;ENV:Testing infrastructure ready;FILE:docs/tdd-guidelines.md;FILE:docs/shared/review-checklist.md;FILE:docs/operations/pr-checklist.md;FILE:packages/db/prisma/schema.prisma","TDD guidelines documented, coverage threshold 90% enforced via CI, code review checklist established; gates: coverage-gte-90","Completed","Coverage ≥90%, zero lint errors, code review time <24h","2","ARTIFACT:docs/tdd-guidelines.md;ARTIFACT:artifacts/misc/ci-coverage-config.yml;ARTIFACT:docs/shared/review-checklist.md;EVIDENCE:artifacts/attestations/IFC-109/context_ack.json","GATE:coverage-gte-90;VALIDATE:pnpm test"
"IFC-110","Testing","Write Unit & Integration Tests for Domain Entities","QA + Backend Dev (STOA-Quality)","IFC-101,IFC-102,IFC-103,IFC-104,IFC-105","FILE:artifacts/sprint0/codex-run/Framework.md;FILE:audit-matrix.yml;ENV:Domain models implemented;FILE:docs/architecture/hex-boundaries.md;FILE:docs/planning/DDD-context-map.puml;FILE:docs/tdd-guidelines.md;FILE:docs/shared/review-checklist.md;FILE:packages/adapters/src/repositories/PrismaLeadRepository.ts;FILE:packages/adapters/src/repositories/PrismaContactRepository.ts;FILE:packages/adapters/src/repositories/PrismaAccountRepository.ts;FILE:packages/adapters/src/repositories/PrismaOpportunityRepository.ts;FILE:packages/adapters/src/repositories/PrismaTaskRepository.ts","All domain entities have unit and integration tests covering business logic and repository operations; artifacts: context_ack.json; targets: >=90%; gates: coverage-gte-90","Completed","Coverage ≥90%, tests passing in CI","4","EVIDENCE:artifacts/attestations/IFC-110/context_ack.json","VALIDATE:pnpm test;GATE:coverage-gte-90"
"IFC-111","Quality","Set up SonarQube and integrate static analysis into CI/CD","DevOps + QA Lead (STOA-Quality)","ENV-005-AI","FILE:artifacts/sprint0/codex-run/Framework.md;FILE:audit-matrix.yml;POLICY:CI/CD pipeline established;FILE:docs/operations/quality-gates.md;FILE:.github/workflows/ci.yml","SonarQube server running, CI pipeline pushes analysis, quality gates defined with OWASP and Clean Code rules; artifacts: sonar-project.properties, ci-sonar.yml, sonar-dashboard.md; targets: zero errors","Completed","Sonar quality gate >= A, zero blocker issues","5","ARTIFACT:artifacts/misc/sonar-project.properties;ARTIFACT:artifacts/misc/ci-sonar.yml;ARTIFACT:docs/shared/sonar-dashboard.md;EVIDENCE:artifacts/attestations/IFC-111/context_ack.json","AUDIT:manual-review"
"IFC-112","Infrastructure","Implement blue/green deployment and rollback strategy","DevOps (STOA-Automation)","ENV-005-AI","FILE:artifacts/sprint0/codex-run/Framework.md;FILE:audit-matrix.yml;ENV:Production environment configured;FILE:docs/operations/release-rollback.md;FILE:.github/workflows/ci.yml","Blue/green deployment pipeline configured, automated health checks, rollback scripts ready; verified by: pnpm test","Completed","Deployment switch <1m, no downtime","5","ARTIFACT:artifacts/metrics/blue-green-metrics.csv;EVIDENCE:artifacts/attestations/IFC-112/context_ack.json","VALIDATE:pnpm test"
"IFC-113","Security","Implement secrets management and encryption at rest and in transit","Security Eng + DevOps (STOA-Security)","IFC-072,IFC-098","FILE:artifacts/sprint0/codex-run/Framework.md;FILE:audit-matrix.yml;POLICY:Database and environment established;FILE:docs/security/zero-trust-design.md;FILE:docs/security/owasp-checklist.md;FILE:packages/db/prisma/schema-audit.prisma","Secrets stored in vault, encrypted connections (TLS/mTLS), data encryption implemented; artifacts: vault-config.yml, encryption-tests.md, context_ack.json; targets: >=100%","Completed","No secrets in repo, 100% encrypted endpoints","10","ARTIFACT:artifacts/misc/vault-config.yml;ARTIFACT:docs/security/encryption-tests.md;EVIDENCE:artifacts/attestations/IFC-113/context_ack.json","AUDIT:manual-review"
"IFC-114","Security","Implement API rate limiting and DDoS protection","Backend Dev + DevOps (STOA-Automation)","IFC-003,IFC-072","FILE:artifacts/sprint0/codex-run/Framework.md;FILE:audit-matrix.yml;POLICY:API endpoints defined;FILE:docs/security/zero-trust-design.md;FILE:docs/security/owasp-checklist.md;FILE:docs/shared/review-checklist.md;FILE:docs/operations/pr-checklist.md;FILE:apps/api/src/trpc.ts","Rate limiting middleware in API, WAF configured for DDoS, tests for request bursts","Completed","No request saturates system, response stable under load (44 tests passed)","7","ARTIFACT:apps/api/src/middleware/rate-limit.ts;ARTIFACT:artifacts/misc/waf-config.json;ARTIFACT:artifacts/misc/ddos-test-report.txt;EVIDENCE:artifacts/attestations/IFC-114/context_ack.json","VALIDATE:pnpm test"
"IFC-115","Resilience","Setup backups and disaster recovery plan","DevOps + DBA (STOA-Automation)","IFC-071","FILE:artifacts/sprint0/codex-run/Framework.md;FILE:audit-matrix.yml;ENV:Production environment configured;FILE:docs/shared/multi-region-architecture.puml","Automated backups scheduled, restore scripts tested, DR documentation prepared; targets: >=100%","Backlog","RPO <5m, RTO <30m, backup success rate 100%","25","ARTIFACT:artifacts/misc/backup-scripts.sh;ARTIFACT:docs/shared/dr-plan.md;ARTIFACT:artifacts/reports/restore-test-report.csv;EVIDENCE:artifacts/attestations/IFC-115/context_ack.json","AUDIT:manual-review;VALIDATE:pnpm test"
"IFC-116","Observability","Instrument application with OpenTelemetry, unify logs, metrics and traces","DevOps + SRE (STOA-Automation)","IFC-074","FILE:artifacts/sprint0/codex-run/Framework.md;FILE:audit-matrix.yml;ENV:OpenTelemetry integrated;ENV:Sentry configured;FILE:docs/architecture/hex-boundaries.md;FILE:artifacts/misc/sentry-project-config.json","All services emit structured logs, traces and metrics; dashboards and alerts created; SLOs defined; targets: >=100%, <2min","Completed","MTTD <2min (actual: 1.2min); 100% services instrumented","9","ARTIFACT:artifacts/misc/otel-config.yaml;ARTIFACT:docs/security/log-schema.md;ARTIFACT:artifacts/misc/dashboards.json;ARTIFACT:artifacts/misc/alert-rules.yml;EVIDENCE:artifacts/attestations/IFC-116/context_ack.json","AUDIT:manual-review"
"IFC-117","AI Insights","Monitor AI models for drift, latency, hallucination and ROI","AI Specialist + SRE (STOA-Intelligence)","IFC-005,AUTOMATION-002","FILE:artifacts/sprint0/codex-run/Framework.md;FILE:audit-matrix.yml;ENV:AI pipelines deployed;FILE:packages/db/prisma/schema.prisma;FILE:docs/operations/quality-gates.md;FILE:apps/ai-worker/src/chains/scoring.chain.ts;FILE:artifacts/misc/optimization-loop.yaml","Metrics collected for AI models; dashboards show drift/hallucination; alerts configured; targets: >=5%","Completed","Drift detected within 1 day, hallucination rate <5%, ROI tracked","10","ARTIFACT:artifacts/metrics/ai-metrics.json;ARTIFACT:artifacts/misc/drift-dashboard.png;ARTIFACT:artifacts/misc/alert-config.yml;EVIDENCE:artifacts/attestations/IFC-117/context_ack.json","AUDIT:manual-review"
"IFC-118","Risk Mgmt","Establish and maintain a risk register with mitigation actions","PM + Tech Lead (STOA-Foundation)","IFC-010,IFC-054","FILE:artifacts/sprint0/codex-run/Framework.md;FILE:audit-matrix.yml;POLICY:Project charter and backlog defined;FILE:artifacts/misc/decision-gate-1.pptx;FILE:artifacts/reports/sonarqube-debt-report.html","Risk register created, risks scored by impact/likelihood, mitigation owners assigned; review scheduled per sprint; artifacts: risk-register.xlsx, risk-mitigation-plan.md, risk-review-agenda.md","Completed","25 risks tracked, all mitigation owners assigned, sprint review scheduled","8","ARTIFACT:artifacts/reports/risk-register.xlsx;ARTIFACT:docs/shared/risk-mitigation-plan.md;ARTIFACT:docs/shared/risk-review-agenda.md;EVIDENCE:artifacts/attestations/IFC-118/context_ack.json","AUDIT:code-review"
"IFC-119","Planning","Define recurring backlog refinement, sprint planning, review and retrospective ceremonies","Scrum Master + PM (STOA-Foundation)","","FILE:artifacts/sprint0/codex-run/Framework.md;FILE:audit-matrix.yml;POLICY:Sprint cadence defined;FILE:docs/shared/review-checklist.md;FILE:docs/operations/pr-checklist.md;FILE:docs/operations/project-playbook.md","Ceremony schedule published; agendas and templates created; meeting outcomes documented; targets: >=100%","Completed","Backlog refined ahead of sprint; retro action items completed; schedule adherence 100%","1","ARTIFACT:artifacts/misc/ceremony-calendar.ics;ARTIFACT:artifacts/reports/retro-action-items.md;ARTIFACT:artifacts/misc/templates/backlog-refinement.md;ARTIFACT:artifacts/misc/templates/daily-standup.md;ARTIFACT:artifacts/misc/templates/sprint-planning.md;ARTIFACT:artifacts/misc/templates/sprint-retrospective.md;ARTIFACT:artifacts/misc/templates/sprint-review.md;EVIDENCE:artifacts/attestations/IFC-119/context_ack.json","AUDIT:manual-review"
