Task ID,Section,Description,Owner,Dependencies,Pre-requisites,Definition of Done,Status,KPIs,Target Sprint,Artifacts To Track,Validation Method,Estimate (O/M/P),Planned Start,Planned Finish,Percent Complete,Dependency Types,Cadence
IFC-233,Core CRM,"Wire Unused Backend tRPC Endpoints - ~20 built but unused tRPC procedures. Lead: convertToDeal, getHotLeads, getReadyForQualification, bulkScore. Contact: getByEmail, linkToAccount, unlinkFromAccount, search, linkToLead, unlinkFromLead, getTimeline, logActivity. Opportunity: create, getById, getHistory, getProducts, getPipeline, stats. Account: create, update. Task: stats, assign, reschedule. Wire each to appropriate frontend UI or remove if not needed.",Full Stack Dev (STOA-Domain),,FILE:apps/api/src/modules/lead/lead.router.ts;FILE:apps/api/src/modules/contact/contact.router.ts;FILE:apps/api/src/modules/opportunity/opportunity.router.ts;FILE:apps/api/src/modules/account/account.router.ts;FILE:apps/api/src/modules/task/task.router.ts,All listed tRPC procedures either wired to frontend UI or explicitly removed with justification; no dead backend code; tests >=90%,Backlog,Zero unused tRPC procedures remain; all wired endpoints have frontend consumers,20,ARTIFACT:apps/web/src/app/leads/[id]/page.tsx;ARTIFACT:apps/web/src/app/contacts/[id]/page.tsx;EVIDENCE:.specify/sprints/sprint-20/attestations/IFC-233/context_ack.json,VALIDATE:pnpm --filter web typecheck;VALIDATE:pnpm --filter api typecheck;VALIDATE:pnpm --filter web test --run;GATE:coverage-gte-90,60/120/240,,,0,,
IFC-234,Core CRM,"Settings Pages Wiring - 4 settings pages with hardcoded data and inert buttons. Team: hardcoded 4-person array, inert Invite/Remove/Role buttons. Integrations: hardcoded provider list, inert Connect/Disconnect buttons. Notifications: hardcoded const, no useState, no onClick on toggles. Account: profile name/email has no save mutation, 3 security buttons (Change Password, Enable 2FA, Download Data) have no onClick. Wire all to real tRPC mutations and queries.",Frontend Dev (STOA-Quality),,FILE:apps/web/src/app/settings/team/page.tsx;FILE:apps/web/src/app/settings/integrations/page.tsx;FILE:apps/web/src/app/settings/notifications/page.tsx;FILE:apps/web/src/app/settings/account/page.tsx,Team page loads real users from API with working Invite/Remove/Role; Integrations shows real connection status; Notifications toggles persist via mutation; Account profile saves name/email; security buttons functional; tests >=90%,Backlog,All settings pages load real data; mutations complete <500ms; no hardcoded arrays,18,ARTIFACT:apps/web/src/app/settings/team/page.tsx;ARTIFACT:apps/web/src/app/settings/integrations/page.tsx;ARTIFACT:apps/web/src/app/settings/notifications/page.tsx;ARTIFACT:apps/web/src/app/settings/account/page.tsx;EVIDENCE:.specify/sprints/sprint-18/attestations/IFC-234/context_ack.json,VALIDATE:pnpm --filter web typecheck;VALIDATE:pnpm --filter web test --run;GATE:coverage-gte-90,60/120/240,,,0,,
IFC-235,Core CRM,"Lead Detail AI Chat Panel - Add AI chat panel to Lead detail page for entity-scoped conversations. Backend: conversation.router.ts is fully built with 13 endpoints but NOT registered in router.ts - register it. Frontend: build LeadChatPanel component using conversation API with contextType=LEAD, contextId=leadId. Similar to dashboard TeamChatWidget but with real API calls (TeamChatWidget is decorative with hardcoded messages). ConversationRecord/MessageRecord Prisma models exist.",Full Stack Dev (STOA-Domain),IFC-069,FILE:apps/api/src/modules/agent/conversation.router.ts;FILE:apps/api/src/router.ts;FILE:apps/web/src/app/leads/[id]/page.tsx;FILE:apps/web/src/components/dashboard/widgets/TeamChatWidget.tsx,conversation router registered in router.ts; LeadChatPanel component sends/receives messages via API; entity-scoped to current lead; message history persisted; streaming responses; tests >=90%,Backlog,Message send <500ms; chat history loads <1s; real AI responses not hardcoded,22,ARTIFACT:apps/web/src/components/leads/LeadChatPanel.tsx;ARTIFACT:apps/api/src/router.ts;EVIDENCE:.specify/sprints/sprint-22/attestations/IFC-235/context_ack.json,VALIDATE:pnpm --filter web typecheck;VALIDATE:pnpm --filter api typecheck;VALIDATE:pnpm --filter web test --run;GATE:coverage-gte-90,60/120/240,,,0,IFC-069:FS,
IFC-236,Core CRM,Recent Activity Empty State CTA - Overview tab shows generic 'No activities yet' with no call to action. Add 'Log your first activity' CTA button linking to Activity tab textarea. Apply same pattern to Contact detail page. Page: leads/[id]/page.tsx line 1600.,Frontend Dev (STOA-Quality),,FILE:apps/web/src/app/leads/[id]/page.tsx,Recent Activity empty state has 'Log your first activity' CTA; CTA navigates to Activity tab; applied to Contact detail; tests >=90%,Completed,CTA visible on empty state; click navigates correctly,16,ARTIFACT:apps/web/src/app/leads/[id]/page.tsx;ARTIFACT:apps/web/src/app/contacts/[id]/page.tsx;EVIDENCE:.specify/sprints/sprint-16/attestations/IFC-236/attestation.json;SPEC:.specify/sprints/sprint-16/specifications/IFC-236-spec.md;PLAN:.specify/sprints/sprint-16/planning/IFC-236-plan.md,VALIDATE:pnpm --filter web typecheck;VALIDATE:pnpm --filter web test --run;GATE:coverage-gte-90,15/30/60,2026-03-12,2026-03-12,100,,
IFC-237,Core CRM,Lead Router Security - Tenant Isolation & Domain Bypass. Fix 4 CRITICAL/MEDIUM security issues: (1) scoreWithAI fire-and-forget uses raw ctx.prisma instead of prismaWithTenant - cross-tenant data leak risk [S2]. (2) logActivity $transaction uses raw ctx.prisma - may bypass tenant middleware [S3]. (3) bulkUpdateStatus uses direct Prisma updateMany bypassing Lead.changeStatus() domain validation - skips status transition rules and domain events [S4]. (4) getHotLeads/getReadyForQualification pass userId as ownerId without explicit tenantId [S9]. Fix: Replace ctx.prisma with prismaWithTenant in all cases. Route bulkUpdateStatus through domain model. Add explicit tenantId to hot/ready queries.,Backend Dev (STOA-Domain),,,All lead router procedures use prismaWithTenant; bulkUpdateStatus routes through Lead.changeStatus(); getHotLeads has explicit tenantId; tenant isolation integration tests pass; no raw ctx.prisma in lead router,Completed,0 raw ctx.prisma calls in lead.router.ts; tenant isolation test coverage >=90%,16,ARTIFACT:apps/api/src/modules/lead/lead.router.ts;SPEC:.specify/sprints/sprint-16/specifications/IFC-237-spec.md;PLAN:.specify/sprints/sprint-16/planning/IFC-237-plan.md,VALIDATE:pnpm --filter @intelliflow/api test --run;VALIDATE:pnpm --filter @intelliflow/api typecheck;GATE:coverage-gte-90,4/6/8,2026-03-12,2026-03-12,100,,Continuous
IFC-238,Core CRM,"Lead Detail Status Type Fix + Auth Guard. Fix 2 CRITICAL issues: (1) LeadStatus type union at leads/[id]/page.tsx line 139 omits NEGOTIATING - runtime crash when lead has this status [S1]. (2) leads/(list)/new/page.tsx missing useRequireAuth() hook - unauthenticated users can access create lead form [F1]. Also fix trpc vs api import inconsistency in create page [F8]. Fix: Add NEGOTIATING to LeadStatus type, add useRequireAuth() to create page, standardize import.",Frontend Dev (STOA-Quality),,,LeadStatus includes all Prisma LeadStatusEnum values; create page has auth guard; no runtime crash for NEGOTIATING leads; trpc import standardized to api; tests >=90%,Completed,0 missing status values in LeadStatus type; auth guard present on /leads/new,16,ARTIFACT:apps/web/src/app/leads/[id]/page.tsx;ARTIFACT:apps/web/src/app/leads/(list)/new/page.tsx;SPEC:.specify/sprints/sprint-16/specifications/IFC-238-spec.md;PLAN:.specify/sprints/sprint-16/planning/IFC-238-plan.md;EVIDENCE:.specify/sprints/sprint-16/attestations/IFC-238/attestation.json,TypeScript compilation + component tests,1/2/3,2026-03-18,2026-03-19,100,,Continuous
IFC-239,Core CRM,"Lead Router Data Integrity Fixes. Fix 5 HIGH issues: (1) update procedure ambiguous status field handling - may silently drop or bypass domain validation [S5]. (2) Score tier thresholds inconsistent - domain LeadScore uses 80/50 but router stats query uses 70/40 [S6]. (3) sortBy accepts arbitrary strings with no enum validation - Prisma orderBy injection risk [S7]. (4) leadListResponseSchema expects 'data' key but router returns 'leads' [W4]. (5) leadResponseSchema missing Lead 360 fields (aiInsight, activities, notes, files, tasks) [D5]. Fix: Explicitly handle status in update, unify thresholds, add sortBy enum, fix schema keys.",Backend Dev (STOA-Domain),,,update procedure explicitly handles status via domain model; score thresholds unified (single source of truth); sortBy validated against enum; response schemas match actual API output; tests >=90%,Completed,0 schema mismatches; sortBy restricted to enum values; single threshold source,16,apps/api/src/modules/lead/lead.router.ts; packages/validators/src/lead.ts; packages/domain/src/crm/lead/LeadScore.ts,Unit tests + schema validation tests,3/5/7,2026-04-06,2026-04-06,100,,Continuous
IFC-240,Core CRM,"Lead Audit Logging. Add audit log entries to all 20 lead router procedures using SecurityAuditService. GDPR-relevant operations (delete, bulkDelete, convert, export) MUST have audit trail. Include: actor (userId), action, entityType (Lead), entityId, tenantId, timestamp, metadata (old/new values for mutations). Integrate with existing audit infrastructure at apps/api/src/security/audit/.",Backend Dev (STOA-Security),,,All 20 lead procedures emit audit entries; delete/convert/bulk ops have before/after snapshots; audit entries queryable via audit API; GDPR compliance verified; tests >=90%,Completed,20/20 procedures with audit logging; 100% GDPR-relevant ops covered,18,apps/api/src/modules/lead/lead.router.ts; apps/api/src/security/audit/,Audit log integration tests,4/6/8,,,100,,Continuous
IFC-241,Core CRM,"Lead Router Dead Code & Missing Events Cleanup. Fix 4 MEDIUM/LOW issues: (1) scoreWithAI notification variables at lines 517-527 set but never referenced - dead code [S10]. (2) LeadRoutedEvent defined in domain but never published by any procedure or service [S11]. (3) Only 3 of ~10 lead event types trigger notifications [W10]. (4) Lead notifications processed synchronously, not queued via BullMQ [W11]. Fix: Remove dead notification code, publish LeadRoutedEvent from routing logic, add notification handlers for remaining event types, enqueue via BullMQ.",Backend Dev (STOA-Domain),,,Dead code removed; LeadRoutedEvent published when lead routing occurs; >=8 event types have notification handlers; notifications enqueued via BullMQ; tests >=90%,Backlog,0 dead code blocks; >=8/10 events with notification handlers,20,apps/api/src/modules/lead/lead.router.ts; packages/domain/src/crm/lead/LeadEvents.ts; apps/workers/notifications-worker/,Event publishing + notification tests,4/6/8,,,0,,Continuous
IFC-242,Core CRM,"Lead Create Form Fixes - BANT Drop, Revenue Mapping, Validation. Fix 3 HIGH issues: (1) BANT fields (Budget, Authority, Need, Timeline) collected in create form but silently dropped on submit - never sent to API [F3]. (2) annualRevenue mapped to estimatedValue - semantic mismatch between company annual revenue and deal estimated value [F4]. (3) Edit form uses 'as any' cast with no client-side Zod validation - no inline field errors [F9]. Fix: Send BANT to API (add to createLeadSchema if needed), map annualRevenue correctly, add Zod resolver to edit form, remove as any.",Frontend Dev (STOA-Quality),,,BANT fields persisted on create; annualRevenue and estimatedValue are distinct fields; edit form uses zodResolver with inline errors; no 'as any' casts; sourceOther sent to API; tests >=90%,Completed,BANT fields round-trip verified; 0 'as any' casts in lead forms,18,apps/web/src/app/leads/(list)/new/page.tsx; apps/web/src/app/leads/[id]/edit/page.tsx; packages/validators/src/lead.ts,Form submission tests + API contract tests,3/5/7,,,0,,Continuous
IFC-243,Core CRM,"Lead Frontend Consistency - StatusBadge, Toast, window.prompt. Fix 3 MEDIUM issues: (1) window.prompt() used for note input at line 1951 - blocks UI, no multi-line, poor UX [F5]. Replace with Dialog/Sheet component. (2) Two different StatusBadge implementations - inline LeadStatusBadge vs shared component with different color schemes [F6]. Consolidate to shared component. (3) Two Toast patterns - sonner toast.success() vs shadcn useToast() used inconsistently across lead pages [F7]. Standardize to one pattern.",Frontend Dev (STOA-Quality),,,Note input uses Dialog component with textarea; single StatusBadge component shared across lead pages; single Toast pattern across all lead pages; tests >=90%,Backlog,0 window.prompt() calls; 1 StatusBadge implementation; 1 Toast pattern,20,apps/web/src/app/leads/[id]/page.tsx; apps/web/src/components/shared/,Component tests + visual regression,2/3/5,,,0,,Continuous
IFC-244,Core CRM,"Dashboard Widget Real Data - ActiveLeads, TotalLeads, Analytics. Fix 3 HIGH/MEDIUM issues: (1) ActiveLeadsWidget fully hardcoded with static '1,240' and 'vs 1,100 last month' [F2]. (2) TotalLeadsWidget shows hardcoded '+12%' trend [W6]. (3) Analytics page for leads uses sample data arrays, no API queries [W7]. Fix: Wire ActiveLeadsWidget to lead.stats API, compute real trend from monthly comparison, wire Analytics page to real lead data endpoints.",Frontend Dev (STOA-Quality),,,ActiveLeadsWidget shows real count from API; TotalLeadsWidget trend computed from actual monthly data; Analytics page queries real lead data; no hardcoded numeric values; tests >=90%,Backlog,0 hardcoded values in dashboard widgets; real data verified against API,20,apps/web/src/components/dashboard/widgets/ActiveLeadsWidget.tsx; apps/web/src/components/dashboard/widgets/TotalLeadsWidget.tsx; apps/web/src/app/analytics/(list)/page.tsx,Widget integration tests + API contract verification,3/4/6,,,0,,Continuous
IFC-245,Core CRM,"Lead Activity Timeline Unification. Fix HIGH issue: logActivity creates LeadActivity records but these are NOT fed into the unified TimelineEvent system (IFC-069). Lead activities exist in a parallel silo [W1]. Also fix: No email-to-lead association - inbound emails not linked to leads by sender address [W2]. Fix: Create TimelineEvent adapter for LeadActivity, add email-to-lead matching in inbound parser, ensure lead detail 'All Sources' toggle shows unified data.",Backend Dev (STOA-Domain),IFC-069:FS,,LeadActivity records appear in unified timeline; inbound emails matched to leads by sender; lead detail All Sources view shows real unified data; tests >=90%,Backlog,LeadActivity → TimelineEvent mapping verified; email-to-lead match rate >0,20,apps/api/src/modules/lead/lead.router.ts; apps/api/src/modules/misc/timeline.ts; apps/api/src/modules/email/inbound.router.ts,Timeline integration tests + email matching tests,4/6/8,,,0,,Continuous
IFC-246,AI Foundation,"Domain Model Lead 360 Alignment. Fix 4 HIGH issues: (1) Lead.toJSON() omits aiInsight, activities, notes, files, tasks relations - domain events carry incomplete snapshots [D1]. (2) qualify() only allows from NEW/CONTACTED but UI doesn't reflect this constraint [D2]. (3) LeadScoringChain throws unhandled error for unknown AI_PROVIDER [D3]. (4) AI scoring prompt only receives basic lead data, ignores activity count, engagement history, note count [D4]. Fix: Extend toJSON, expose allowed transitions, add provider fallback, enrich scoring prompt.",AI Specialist (STOA-Intelligence),,,Lead.toJSON() includes 360 fields; qualify() exposes valid-from-status list; LeadScoringChain gracefully handles unknown providers; scoring prompt includes 360 context; tests >=90%,Backlog,toJSON() includes 5 relation fields; scoring prompt includes >=3 360 data points,20,packages/domain/src/crm/lead/Lead.ts; packages/domain/src/crm/lead/LeadScore.ts; apps/ai-worker/src/chains/,Domain model tests + scoring chain tests,3/5/7,,,0,,Continuous
IFC-247,Core CRM,"Lead Detail Page Tests. Lead detail page (2200+ lines) has ZERO component tests [T1]. Also untested: addNote procedure [T4] and logActivity procedure [T5] added 2026-03-04. Write comprehensive tests: (1) Component render tests for all tabs (Overview, Activity, AI Insights, Lead IQ, Notes, Files, Emails, Tasks). (2) Mutation tests for addNote and logActivity. (3) Error state tests (404, 500, retry). (4) AI insight null-state rendering. (5) Activity feed toggle. Must cover 2026-03-04 wiring fixes.",Frontend Dev (STOA-Quality),,,Lead detail page test file exists with >=20 test cases; addNote mutation tested; logActivity mutation tested; error states tested; AI insight null-state tested; coverage >=90% for tested paths,Plan Complete,>=20 test cases; coverage >=90% for leads/[id]/page.tsx,18,apps/web/src/app/leads/[id]/__tests__/page.test.tsx,vitest run with coverage,4/6/8,2026-06-29,,50,,Continuous
IFC-248,Core CRM,"Lead List & Create Page Tests. Two major pages with ZERO tests: (1) Lead list page with filtering, sorting, bulk operations, saved views [T2]. (2) Lead create page (1029 lines) with BANT fields, source handling, validation [T3]. Also test: (3) Role-based filtering (ADMIN sees all, others see own) [T7]. (4) Bulk operations UI (score, convert, archive, delete) [T8]. Write component tests covering happy path, error states, and edge cases.",Frontend Dev (STOA-Quality),,,"Lead list test file with >=15 cases (filter, sort, bulk ops, role-based); Lead create test file with >=10 cases (BANT, validation, submission); coverage >=90%",Completed,>=25 total test cases across 2 files; coverage >=90%,18,apps/web/src/app/leads/(list)/__tests__/page.test.tsx; apps/web/src/app/leads/(list)/new/__tests__/page.test.tsx,vitest run with coverage,4/6/8,,,0,,Continuous
IFC-249,Core CRM,"Lead Edit Page Tests + E2E. Fix remaining test gaps: (1) Edit page onSuccess/onError callbacks untested, as any cast hides type errors [T9]. (2) No E2E tests for complete lead CRUD flow (create -> view -> edit -> delete) [T6]. Write: (1) Edit page component tests with mutation mocking. (2) Playwright E2E test for full lead lifecycle. E2E should cover: create lead with required fields, view on detail page, edit fields, archive/delete.",Frontend Dev (STOA-Quality),,,Edit page test file with >=8 cases; Playwright E2E test for lead CRUD lifecycle; edit page mutation callbacks covered; coverage >=90%,Backlog,>=8 edit page tests; 1 E2E test with >=5 assertions,20,apps/web/src/app/leads/[id]/edit/__tests__/page.test.tsx; tests/e2e/lead-crud.spec.ts,vitest run + playwright test,4/6/8,,,0,,Continuous
IFC-250,Core CRM,"Lead Event Pipeline - Persistent Outbox + Webhooks. Fix HIGH/LOW issues: (1) InMemoryEventBus loses all events on server restart - no persistent outbox pattern [W3]. (2) No webhook handlers for lead events - external systems cannot subscribe [W9]. Fix: Implement transactional outbox pattern for lead domain events (LeadCreatedEvent, LeadQualifiedEvent, etc.). Add webhook dispatch for lead events. Ensure event ordering and at-least-once delivery.",Backend Dev (STOA-Domain),,,Lead events persisted to outbox table; outbox processor dispatches to webhook subscribers; events survive server restart; at-least-once delivery guaranteed; webhook payload schema documented; tests >=90%,Backlog,0 events lost on restart; webhook delivery latency <5s,22,apps/api/src/container.ts; apps/api/src/webhooks/handler.ts; packages/db/prisma/schema.prisma,Outbox integration tests + webhook delivery tests,6/8/12,,,0,,Continuous
IFC-251,Core CRM,"Lead CSV Import/Export. Add bulk import and export for leads [W8]. Import: CSV upload with validation, duplicate detection, field mapping UI, error report. Export: CSV and JSON formats, filtered export (current view), all-fields export. Common CRM feature needed for data migration and reporting. Also cleanup: Prisma schema backslash comments to standard // format [S12].",Frontend Dev (STOA-Quality),,,CSV import with validation UI and error report; CSV/JSON export with filter support; Prisma comments standardized; import handles duplicates gracefully; tests >=90%,Backlog,Import handles >=1000 rows; export completes <5s for 10K leads,24,apps/web/src/app/leads/(list)/; apps/api/src/modules/lead/lead.router.ts,Import/export integration tests,6/8/12,,,0,,Continuous
IFC-252,Core CRM,Contact Router Security — Tenant Isolation Fixes. CRITICAL: (1) search procedure has no createTenantWhereClause — cross-tenant search by name/email (R-02). (2) logActivity transaction uses raw ctx.prisma with no tenantId in WHERE — cross-tenant update (R-03). (3) bulkEmail/bulkExport no tenant filter — email exfiltration via guessed UUIDs (R-04). (4) stats ignores typedCtx tenant — no tenantId boundary (R-05). (5) getById/getByEmail double-fetch through unscoped domain repo (R-06). Cross-ref: R-01 (prismaWithTenant raw) is cross-cutting and shared with IFC-237. Audit: docs/audit/contact-detail-wiring-audit.md §15.,Backend Dev (STOA-Domain),,FILE:docs/audit/contact-detail-wiring-audit.md,All contact router procedures use createTenantWhereClause; logActivity transaction uses prismaWithTenant; search/bulkEmail/bulkExport tenant-scoped; getById/getByEmail cross-check tenantId; tests >=90%,Completed,Zero cross-tenant data leaks in contact procedures,16,ARTIFACT:apps/api/src/modules/contact/contact.router.ts,VALIDATE:pnpm test --filter @intelliflow/api,120/240/480,2026-03-12,2026-03-12,100,,
IFC-253,Core CRM,Contact Detail NaN Fix + Auth Guard + Status Enum. CRITICAL: (1) NaN% division by zero — emailsOpened/emailsSent at line 1319 renders 'NaN%' when emailsSent=0 (F-01). (2) Create contact page missing useRequireAuth() — unauthenticated access (F-07). (3) Status enum truncated to 3 values in ContactList/ContactCard (ACTIVE/INACTIVE/ARCHIVED) but create form allows 6 values — unknown status crashes detail page statusConfig (F-08). Audit: docs/audit/contact-detail-wiring-audit.md §16.,Frontend Dev (STOA-Quality),,FILE:docs/audit/contact-detail-wiring-audit.md,Open Rate handles 0/0 gracefully; create page has useRequireAuth; ContactStatusBadge handles all 5 domain statuses with fallback; tests >=90%,Completed,No NaN renders; auth guard on create; no crash on unknown status,16,ARTIFACT:apps/web/src/app/contacts/[id]/page.tsx;ARTIFACT:apps/web/src/app/contacts/(list)/new/page.tsx;ARTIFACT:apps/web/src/components/contacts/ContactCard.tsx;ARTIFACT:apps/web/src/components/contacts/ContactList.tsx;ARTIFACT:apps/web/src/app/contacts/[id]/page.tsx,VALIDATE:pnpm test --filter @intelliflow/web,60/120/240,,,100,2026-03-12,2026-03-13
IFC-254,Core CRM,"Contact Router Data Integrity Fixes. (1) Raw SQL in getTimeline has no tenant filter and .catch(() => []) swallows errors (R-09). (2) sortBy accepts arbitrary strings — enum whitelist needed (R-10). (3) filterOptions ignores status input (R-12). (4) contactListResponseSchema uses 'data' key but router returns 'contacts' (D-03). (5) phone non-nullable in response schema but mapper returns null (D-08/R-14). Audit: docs/audit/contact-detail-wiring-audit.md §15,§18.",Backend Dev (STOA-Domain),,FILE:docs/audit/contact-detail-wiring-audit.md,getTimeline has tenant filter and proper error handling; sortBy uses enum whitelist; filterOptions respects input; schema keys match router response; phone schema nullable; tests >=90%,Completed,Zero data integrity issues in contact router,16,ARTIFACT:apps/api/src/modules/contact/contact.router.ts;ARTIFACT:packages/validators/src/contact.ts,VALIDATE:pnpm test --filter @intelliflow/api,60/120/240,2026-03-15,2026-03-16,100,SPEC:.specify/sprints/sprint-16/specifications/IFC-254-spec.md;PLAN:.specify/sprints/sprint-16/planning/IFC-254-plan.md,
IFC-255,Core CRM,"Contact Audit Logging. (1) Zero audit logging in all 14 contact router procedures — no ctx.security.auditLogger calls (R-07). (2) Audit event handler PascalCase keys (ContactCreated/Updated/Deleted) don't match domain dot-notation (contact.created/updated) — 5 event types unmapped (D-06). Violates IFC-098 audit requirement. Audit: docs/audit/contact-detail-wiring-audit.md §15,§18.",Backend Dev (STOA-Domain),,FILE:docs/audit/contact-detail-wiring-audit.md,All contact CRUD procedures emit audit events; event handler maps all 8 contact event types; audit trail for create/update/delete/bulk ops; tests >=90%,Completed,14/14 contact procedures emit audit events,18,ARTIFACT:apps/api/src/modules/contact/contact.router.ts;ARTIFACT:apps/api/src/security/audit-event-handler.ts,VALIDATE:pnpm test --filter @intelliflow/api,120/240/480,,,0,,
IFC-256,Core CRM,"Contact Detail Hardcoded Tabs — Tickets & Documents. (1) Tickets tab fully hardcoded with 'TKT-1234' and static timestamp (F-02, F-21). ContactWithRelations has no tickets relation. Tab badge hardcoded to 0. (2) Documents tab hardcoded with 2 static PDFs — apiContact.documents data exists in interface but is completely ignored (F-03). Need: wire tickets via TicketService query, wire documents from apiContact.documents or file infrastructure. Audit: docs/audit/contact-detail-wiring-audit.md §5,§9,§16.",Frontend Dev (STOA-Quality),,FILE:docs/audit/contact-detail-wiring-audit.md,Tickets tab shows real data from API (or proper empty state); Documents tab renders apiContact.documents; tab badges dynamic; no hardcoded data; tests >=90%,Completed,Zero hardcoded data in Tickets and Documents tabs,18,ARTIFACT:apps/web/src/app/contacts/[id]/page.tsx,VALIDATE:pnpm test --filter @intelliflow/web,120/240/480,2026-06-10,2026-06-10,100,,
