Task ID,Section,Description,Owner,Dependencies,Pre-requisites,Definition of Done,Status,KPIs,Target Sprint,Artifacts To Track,Validation Method,Estimate (O/M/P),Planned Start,Planned Finish,Percent Complete,Dependency Types,Cadence
IFC-297,AI Foundation,"AI Monitoring Data Persistence — Replace in-memory singleton monitoring data (driftDetector, latencyMonitor, hallucinationChecker, roiTracker) with DB-backed persistence via new AIMonitoringEvent model. Add ai-worker flush service to write metrics to DB periodically. Rewrite monitoring router to query DB instead of in-process singletons. Enables multi-process deployments to share monitoring data.",Backend Dev (STOA-Domain),"IFC-015,IFC-025",FILE:apps/api/src/modules/ai-monitoring/ai-monitoring.router.ts;FILE:apps/ai-worker/src/monitoring/index.ts;FILE:packages/db/prisma/schema.prisma;ENV:PostgreSQL running,"AIMonitoringEvent Prisma model created with migration; ai-worker flushes metrics to DB every 60s; monitoring router queries DB; drift/latency/ROI dashboards show real data in multi-process mode; targets: flush latency <100ms, coverage >90%; verified by: pnpm test",Completed,"Coverage >90%, Flush latency <100ms, Multi-process data visible",16,ARTIFACT:packages/db/prisma/migrations/*_ai_monitoring_events;ARTIFACT:apps/ai-worker/src/monitoring/monitoring-flush.service.ts;ARTIFACT:apps/api/src/modules/ai-monitoring/ai-monitoring.router.ts,VALIDATE:pnpm typecheck;VALIDATE:pnpm test;VALIDATE:pnpm lint;VALIDATE:pnpm build,180/360/720,2026-03-15,2026-03-16,100,"IFC-015:FS,IFC-025:FS",
IFC-298,Support,HelpArticle Prisma Model + Migration,Backend Dev (STOA-Domain),PG-045,FILE:packages/db/prisma/schema.prisma;FILE:apps/web/src/lib/support/help-articles.ts;FILE:docs/planning/prd-support-help-center.md,"HelpArticle, ArticleSection, ArticleFeedback Prisma models; migration applied; fields match HelpArticle TS interface; status enum (draft/published); verified by: pnpm test",Completed,3 models + 1 enum + migration + 14 tests; all 4 validations pass,17,ARTIFACT:packages/db/prisma/schema.prisma;ARTIFACT:packages/db/prisma/migrations/20260311000000_add_help_article_models/migration.sql;EVIDENCE:.specify/sprints/sprint-17/attestations/IFC-298/context_ack.json;EVIDENCE:.specify/sprints/sprint-17/attestations/IFC-298/attestation.json;SPEC:.specify/sprints/sprint-17/specifications/IFC-298-spec.md;PLAN:.specify/sprints/sprint-17/planning/IFC-298-plan.md,VALIDATE:pnpm --filter @intelliflow/db typecheck;VALIDATE:pnpm test,60/120/240,2026-03-10,2026-03-10,100,PG-045:FS,
IFC-299,Support,Help Article CRUD tRPC Router,Backend Dev (STOA-Domain),IFC-298,FILE:packages/db/prisma/schema.prisma;FILE:apps/api/src/router.ts;FILE:docs/planning/prd-support-help-center.md,helpArticle tRPC router with list/getBySlug/getByCategory/getRelated/create/update/delete/publish/unpublish; tenant-scoped; coverage >=90%; verified by: pnpm test,Completed,"9 procedures, 49 tests, coverage 91%/80%/100%/95%",17,ARTIFACT:apps/api/src/modules/help-article/help-article.router.ts;ARTIFACT:packages/validators/src/help-article.ts;EVIDENCE:.specify/sprints/sprint-17/attestations/IFC-299/context_ack.json;EVIDENCE:.specify/sprints/sprint-17/attestations/IFC-299/attestation.json;SPEC:.specify/sprints/sprint-17/specifications/IFC-299-spec.md;PLAN:.specify/sprints/sprint-17/planning/IFC-299-plan.md,VALIDATE:pnpm --filter @intelliflow/api typecheck;VALIDATE:pnpm test;GATE:coverage-gte-90,90/180/360,2026-03-18,2026-03-19,100,IFC-298:FS,
IFC-300,Support,Help Article Seed Script — Static to DB Migration,Backend Dev (STOA-Foundation),IFC-298,FILE:packages/db/prisma/schema.prisma;FILE:apps/web/src/lib/support/help-articles.ts,Seed script migrates DEFAULT_HELP_ARTICLES into DB; idempotent (skip existing slugs); validates data integrity post-seed; verified by: pnpm test,Backlog,"17 articles seeded, idempotent re-run passes",17,ARTIFACT:packages/db/prisma/seed-help-articles.ts;EVIDENCE:.specify/sprints/sprint-17/attestations/IFC-300/context_ack.json,VALIDATE:pnpm --filter @intelliflow/db typecheck;VALIDATE:pnpm test,60/120/240,,,0,IFC-298:FS,
IFC-303,Support,Article Feedback tRPC Mutation,Backend Dev (STOA-Domain),IFC-298,FILE:packages/db/prisma/schema.prisma;FILE:apps/web/src/components/support/feedback-widget.tsx,helpArticle.submitFeedback mutation stores feedback in ArticleFeedback table; FeedbackWidget onFeedback wired to tRPC; analytics aggregation; coverage >=90%; verified by: pnpm test,Completed,Stmts 91.45% Branch 80.48% Funcs 100% Lines 95.45%; 59 router + 17 widget tests pass,17,ARTIFACT:apps/api/src/modules/help-article/help-article.router.ts;EVIDENCE:.specify/sprints/sprint-17/attestations/IFC-303/context_ack.json;EVIDENCE:.specify/sprints/sprint-17/attestations/IFC-303/attestation.json;SPEC:.specify/sprints/sprint-17/specifications/IFC-303-spec.md;PLAN:.specify/sprints/sprint-17/planning/IFC-303-plan.md,VALIDATE:pnpm --filter @intelliflow/api typecheck;VALIDATE:pnpm test;GATE:coverage-gte-90,60/120/240,2026-03-18,2026-03-19,100,IFC-298:FS,
PG-180,Support Pages,Help Article Admin List Page,Support Eng (STOA-Domain),IFC-299,FILE:apps/api/src/modules/help-article/help-article.router.ts;FILE:docs/planning/prd-support-help-center.md;DESIGN:docs/design/README.md,"Response <200ms, Lighthouse >=90; admin page at /settings/help-center/articles with article list, status badges, category filters, search, CRUD actions; verified by: pnpm test",Backlog,"Articles listed, filters working, CRUD actions functional",18,ARTIFACT:apps/web/src/app/settings/help-center/articles/page.tsx;ARTIFACT:apps/web/src/components/support/article-admin-list.tsx;EVIDENCE:.specify/sprints/sprint-18/attestations/PG-180/context_ack.json,GATE:lighthouse-gte-90;VALIDATE:pnpm --filter @intelliflow/web typecheck;VALIDATE:pnpm --filter @intelliflow/web test --run,90/180/360,,,0,IFC-299:FS,
IFC-301,Infrastructure,Rich Text Editor Integration — Tiptap,Frontend Dev (STOA-Foundation),PG-180,FILE:packages/ui/src/index.ts;FILE:docs/planning/prd-support-help-center.md,Tiptap editor as reusable @intelliflow/ui component; headings/bold/italic/lists/links/images/code blocks; exports structured sections; coverage >=90%; verified by: pnpm test,Backlog,"Editor renders, all formatting works, structured output correct",18,ARTIFACT:packages/ui/src/components/rich-text-editor.tsx;ARTIFACT:packages/ui/src/components/__tests__/rich-text-editor.test.tsx;EVIDENCE:.specify/sprints/sprint-18/attestations/IFC-301/context_ack.json,VALIDATE:pnpm --filter @intelliflow/ui typecheck;VALIDATE:pnpm test;GATE:coverage-gte-90,120/240/480,,,0,PG-180:FS,
PG-181,Support Pages,Help Article Editor Page,Support Eng (STOA-Domain),"PG-180,IFC-301",FILE:apps/web/src/app/settings/help-center/articles/page.tsx;FILE:packages/ui/src/components/rich-text-editor.tsx;DESIGN:docs/design/README.md,"Response <200ms, Lighthouse >=90; editor at /settings/help-center/articles/[id]/edit and /new; Tiptap editor, metadata fields, preview, save draft, publish; verified by: pnpm test",Backlog,"Articles editable, preview works, draft/publish functional",18,ARTIFACT:apps/web/src/app/settings/help-center/articles/[id]/edit/page.tsx;ARTIFACT:apps/web/src/app/settings/help-center/articles/new/page.tsx;EVIDENCE:.specify/sprints/sprint-18/attestations/PG-181/context_ack.json,GATE:lighthouse-gte-90;VALIDATE:pnpm --filter @intelliflow/web typecheck;VALIDATE:pnpm --filter @intelliflow/web test --run,90/180/360,,,0,"PG-180:FS,IFC-301:FS",
IFC-302,Support,Refactor Help Article Page to Use Database,Support Eng (STOA-Domain),IFC-299,FILE:apps/web/src/app/help-center/[article]/page.tsx;FILE:apps/api/src/modules/help-article/help-article.router.ts,"Replace static DEFAULT_HELP_ARTICLES in [article]/page.tsx with tRPC queries; same UI, DB data source; static dependency removed; all tests passing; verified by: pnpm test",Backlog,"Page renders from DB, no static imports, tests passing",18,ARTIFACT:apps/web/src/app/help-center/[article]/page.tsx;EVIDENCE:.specify/sprints/sprint-18/attestations/IFC-302/context_ack.json,VALIDATE:pnpm --filter @intelliflow/web typecheck;VALIDATE:pnpm --filter @intelliflow/web test --run,60/120/240,,,0,IFC-299:FS,
IFC-304,Support,Article Analytics Dashboard,Support Eng (STOA-Domain),"IFC-303,PG-180",FILE:apps/api/src/modules/help-article/help-article.router.ts;FILE:apps/web/src/app/settings/help-center/articles/page.tsx,"Analytics in help article admin; views, feedback stats, most/least helpful, search terms; helpArticle.getAnalytics tRPC; coverage >=90%; verified by: pnpm test",Backlog,"Analytics render, data accurate, coverage >=90%",19,ARTIFACT:apps/web/src/components/support/article-analytics.tsx;ARTIFACT:apps/api/src/modules/help-article/help-article.router.ts;EVIDENCE:.specify/sprints/sprint-19/attestations/IFC-304/context_ack.json,VALIDATE:pnpm --filter @intelliflow/web typecheck;VALIDATE:pnpm test;GATE:coverage-gte-90,90/180/360,,,0,"IFC-303:FS,PG-180:FS",
PG-182,Settings,Module Settings - Contacts (/contacts/contact-settings),Frontend Dev (STOA-Foundation),PG-178,FILE:apps/web/src/components/sidebar/configs/contacts.ts;FILE:apps/web/src/components/contacts/ContactSettingsSidebarNav.tsx,"Contact settings page at /contacts/contact-settings with duplicate detection, required fields, tags config; uses in-module settings sidebar pattern; Lighthouse >=90; verified by: pnpm test",Backlog,All form fields render and save; sidebar settings nav works; Lighthouse >=90,17,ARTIFACT:apps/web/src/app/contacts/(list)/contact-settings/page.tsx,VALIDATE:pnpm test,120/240/480,,,0,PG-178:FS,
PG-183,Settings,Module Settings - Accounts (/accounts/account-settings),Frontend Dev (STOA-Foundation),PG-178,FILE:apps/web/src/components/sidebar/configs/accounts.ts;FILE:apps/web/src/components/accounts/AccountSettingsSidebarNav.tsx,"Account settings page at /accounts/account-settings with hierarchy, industry, custom fields config; uses in-module settings sidebar pattern; Lighthouse >=90; verified by: pnpm test",Backlog,All form fields render and save; sidebar settings nav works; Lighthouse >=90,17,ARTIFACT:apps/web/src/app/accounts/(list)/account-settings/page.tsx,VALIDATE:pnpm test,120/240/480,,,0,PG-178:FS,
PG-184,Settings,Module Settings - Deals (/deals/deal-settings),Frontend Dev (STOA-Foundation),PG-178,FILE:apps/web/src/components/sidebar/configs/deals.ts;FILE:apps/web/src/components/deals/DealSettingsSidebarNav.tsx,"Deal settings page at /deals/deal-settings with pipeline stages, win-loss reasons, scoring config; uses in-module settings sidebar pattern; Lighthouse >=90; verified by: pnpm test",Backlog,All form fields render and save; sidebar settings nav works; Lighthouse >=90,17,ARTIFACT:apps/web/src/app/deals/deal-settings/page.tsx,VALIDATE:pnpm test,120/240/480,,,0,PG-178:FS,
PG-185,Settings,Module Settings - Tickets (/tickets/sla-policies),Frontend Dev (STOA-Foundation),PG-178,FILE:apps/web/src/components/sidebar/configs/tickets.ts;FILE:apps/web/src/components/tickets/TicketSettingsSidebarNav.tsx,"Ticket settings page at /tickets/sla-policies with default SLA, auto-close, notification triggers config; uses in-module settings sidebar pattern; Lighthouse >=90; verified by: pnpm test",Backlog,All form fields render and save; sidebar settings nav works; Lighthouse >=90,17,ARTIFACT:apps/web/src/app/tickets/sla-policies/page.tsx,VALIDATE:pnpm test,120/240/480,,,0,PG-178:FS,
PG-186,Settings,Module Settings - Documents (/documents/document-settings),Frontend Dev (STOA-Foundation),PG-178,FILE:apps/web/src/components/sidebar/configs/documents.ts;FILE:apps/web/src/components/documents/DocumentSettingsSidebarNav.tsx,"Document settings page at /documents/document-settings with file types, size limits, antivirus, retention config; uses in-module settings sidebar pattern; Lighthouse >=90; verified by: pnpm test",Backlog,All form fields render and save; sidebar settings nav works; Lighthouse >=90,17,ARTIFACT:apps/web/src/app/documents/document-settings/page.tsx,VALIDATE:pnpm test,120/240/480,,,0,PG-178:FS,
PG-187,Settings,Module Settings - Reports (/analytics/report-settings),Frontend Dev (STOA-Foundation),PG-178,FILE:apps/web/src/components/settings/ModuleSettingsLayout.tsx,"Report settings page at /analytics/report-settings with default range, currency, scheduled delivery config; uses in-module settings sidebar pattern; Lighthouse >=90; verified by: pnpm test",Backlog,All form fields render and save; sidebar settings nav works; Lighthouse >=90,18,ARTIFACT:apps/web/src/app/analytics/report-settings/page.tsx,VALIDATE:pnpm test,120/240/480,,,0,PG-178:FS,
PG-188,Settings,Module Settings - Billing (/billing/settings),Frontend Dev (STOA-Foundation),PG-178,FILE:apps/web/src/components/settings/ModuleSettingsLayout.tsx,"Billing settings page at /billing/settings with billing address, tax ID, invoice contact config; uses in-module settings sidebar pattern; Lighthouse >=90; verified by: pnpm test",Backlog,All form fields render and save; sidebar settings nav works; Lighthouse >=90,18,ARTIFACT:apps/web/src/app/billing/settings/page.tsx,VALIDATE:pnpm test,120/240/480,,,0,PG-178:FS,
PG-189,Settings,Module Settings - Appointments (/calendar/calendar-settings),Frontend Dev (STOA-Foundation),PG-178,FILE:apps/web/src/components/sidebar/configs/appointments.ts;FILE:apps/web/src/components/calendar/CalendarSettingsSidebarNav.tsx,"Appointment settings page at /calendar/calendar-settings with duration, buffer, calendar integration config; uses in-module settings sidebar pattern; Lighthouse >=90; verified by: pnpm test",Backlog,All form fields render and save; sidebar settings nav works; Lighthouse >=90,18,ARTIFACT:apps/web/src/app/calendar/calendar-settings/page.tsx,VALIDATE:pnpm test,120/240/480,,,0,PG-178:FS,
PG-190,Settings,Module Settings - Cases (/cases/case-settings),Frontend Dev (STOA-Foundation),PG-178,FILE:apps/web/src/components/sidebar/configs/cases.ts;FILE:apps/web/src/components/cases/CaseSettingsSidebarNav.tsx,"Case settings page at /cases/case-settings with case prefix, default priority, auto-assign config; uses in-module settings sidebar pattern; Lighthouse >=90; verified by: pnpm test",Backlog,All form fields render and save; sidebar settings nav works; Lighthouse >=90,18,ARTIFACT:apps/web/src/app/cases/case-settings/page.tsx,VALIDATE:pnpm test,120/240/480,,,0,PG-178:FS,
PG-191,Settings,Module Settings - Tasks (/tasks/task-settings),Frontend Dev (STOA-Foundation),PG-178,FILE:apps/web/src/components/sidebar/configs/tasks.ts;FILE:apps/web/src/components/tasks/TaskSettingsSidebarNav.tsx,"Task settings page at /tasks/task-settings with due-date offset, reminder, templates config; uses in-module settings sidebar pattern; Lighthouse >=90; verified by: pnpm test",Backlog,All form fields render and save; sidebar settings nav works; Lighthouse >=90,18,ARTIFACT:apps/web/src/app/tasks/(list)/task-settings/page.tsx,VALIDATE:pnpm test,120/240/480,,,0,PG-178:FS,
PG-192,AI Intelligence,Fix missing /agent-approvals/logs page — PG-152 regression; AgentLogsViewer component exists at apps/web/src/components/ai-monitoring/AgentLogsViewer.tsx but page.tsx is absent causing 404 on route,Frontend Dev (STOA-Intelligence),PG-152,FILE:apps/web/src/components/ai-monitoring/AgentLogsViewer.tsx;FILE:apps/web/src/components/sidebar/configs/agent-approvals.ts,page.tsx created at apps/web/src/app/agent-approvals/logs/page.tsx; route /agent-approvals/logs renders AgentLogsViewer with auth guard and Suspense boundary; matches PG-151/PG-150 shell pattern; Lighthouse >=90; verified by: pnpm test,Completed,Route no longer 404; page loads <500ms; Lighthouse >=90; test coverage >=90%,16,ARTIFACT:apps/web/src/app/agent-approvals/logs/page.tsx;SPEC:.specify/sprints/sprint-16/specifications/PG-192-spec.md;PLAN:.specify/sprints/sprint-16/planning/PG-192-plan.md;EVIDENCE:.specify/sprints/sprint-16/attestations/PG-192/context_ack.json,VALIDATE:pnpm --filter @intelliflow/web typecheck;VALIDATE:pnpm --filter @intelliflow/web test --run,30/60/120,2026-03-17,2026-03-17,100,PG-152:FS,
PG-193,AI Intelligence,Workflow Step Progress Panel — Add real-time N/N step progress tracker to /agent-approvals/agents and /agent-approvals/logs; reads WorkflowExecution.currentStep + stepResults from tRPC; shows named steps with status icons (pending/running/completed/failed) and a % progress bar matching the AEO workflow progress UI pattern,Frontend Dev (STOA-Intelligence),"PG-151,PG-192",DESIGN:docs/design/mockups/workflow-progress-panel.png;FILE:apps/web/src/components/ai-monitoring/ActiveAgentsDashboard.tsx;FILE:apps/web/src/components/ai-monitoring/AgentLogsViewer.tsx;FILE:packages/db/generated/prisma/models/WorkflowExecution.ts,WorkflowProgressPanel component created; integrated into ActiveAgentsDashboard agent detail expand and AgentLogsViewer log detail view; reads currentStep and stepResults from WorkflowExecution via tRPC; renders progress bar + per-step status with checkmarks; WCAG AA accessible; Lighthouse >=90; verified by: pnpm test. NOTE: 3 follow-ups for whoever touches workflow next — (1) workflow.getExecution procedure has no production caller yet (wire a deep-link page or remove); (2) KNOWN_ENTITY_TYPES in workflow.router.ts is hardcoded (update when adding new entity kinds or derive from @intelliflow/domain); (3) entityId-only fallback returns most-recent workflow per entity which is ambiguous for multi-workflow entities (long-term: add workflowExecutionId FK on ConversationRecord). See memory/project_pg193_follow_ups.md,Completed,Progress panel renders <200ms; step states accurate; accessible (WCAG AA); Lighthouse >=90; test coverage >=90%,16,ARTIFACT:apps/web/src/components/ai-monitoring/WorkflowProgressPanel.tsx;ARTIFACT:apps/web/src/components/ai-monitoring/__tests__/WorkflowProgressPanel.test.tsx,VALIDATE:pnpm --filter @intelliflow/web typecheck;VALIDATE:pnpm --filter @intelliflow/web test --run,120/240/480,2026-03-19,2026-04-09,100,"PG-151:FS,PG-192:FS",
IFC-305,Core CRM,"Componentize CRM entity detail pages (Leads, Contacts) — extract shared SOLID-compliant components from 5284 lines of duplicated god-files; wire bypassed shared components (EntityHeader, SearchFilterBar, ActivityFeed); create cross-entity reusable components (EntityProfileCard, ActivityFilterBar, AiInsightMetricsGrid, ai-insight-transforms utility, EntityErrorState, EntityDetailSkeleton, ConfirmationDialog); reduce page files from 2691/2593 to ~200 lines each",Frontend Dev (STOA-Quality),IFC-226,FILE:apps/web/src/app/leads/[id]/page.tsx;FILE:apps/web/src/app/contacts/[id]/page.tsx;FILE:apps/web/src/components/contacts/ContactDetail.tsx;FILE:apps/web/src/components/shared/entity-header.tsx;FILE:apps/web/src/components/shared/search-filter-bar.tsx;FILE:docs/planning/prd-core-crm.md;FILE:docs/planning/adr/ADR-045-entity-detail-componentization.md,Entity detail pages reduced to <300 lines each; shared components extracted and reused across leads/contacts; EntityHeader/SearchFilterBar/ActivityFeed wired; AI insight transforms deduplicated into shared utility; each component independently testable >=90% coverage; zero functional regression; verified by: pnpm typecheck + test + lint + build,Backlog,Page file reduction >=80%; Component coverage >=90%; Shared component reuse (3+ bypassed wired); Duplication eliminated >=1500 lines,19,ARTIFACT:apps/web/src/components/leads/LeadDetail.tsx;ARTIFACT:apps/web/src/components/shared/entity-profile-card.tsx;ARTIFACT:apps/web/src/lib/shared/ai-insight-transforms.ts;EVIDENCE:.specify/sprints/sprint-19/attestations/IFC-305/context_ack.json,VALIDATE:pnpm --filter web typecheck;VALIDATE:pnpm --filter web test --run;VALIDATE:pnpm --filter web lint;VALIDATE:pnpm --filter web build;GATE:coverage-gte-90,180/360/720,,,0,IFC-226:FS,
IFC-306,Compliance,"Fix Compliance Calendar Seed Data — replace fabricated/stale events in compliance-calendar.json with realistic SaaS CRM compliance milestones; remove irrelevant ISO 14001 events; update 6 past events still marked scheduled to completed; extend date range through 2026-12 covering GDPR quarterly reviews, SOC 2 audit cycle, ISO 27001 surveillance, ISO 42001 certification path, OWASP assessments; update metadata version and lastUpdated",DPO + Legal (STOA-Foundation),IFC-073,FILE:artifacts/misc/compliance-calendar.json;FILE:apps/web/src/app/api/compliance/timeline/route.ts;FILE:apps/web/src/app/api/compliance/types.ts,"compliance-calendar.json has 22 events covering 4 standards (GDPR, SOC 2, ISO 27001, ISO 42001, OWASP); no ISO 14001; all past events status=completed; all future events status=scheduled; date range Oct 2025–Dec 2026; timeline API serves updated data; verified by: pnpm test",Backlog,22 events; 0 stale statuses; 5 standards; 12-month forward coverage; API returns updated events,19,ARTIFACT:artifacts/misc/compliance-calendar.json;EVIDENCE:.specify/sprints/sprint-19/attestations/IFC-306/context_ack.json,VALIDATE:pnpm --filter web typecheck;VALIDATE:pnpm --filter web test --run,15/30/60,,,0,IFC-073:FS,
PG-194,Governance Pages,"Governance Compliance Dashboard — register and wire existing /governance/compliance page; replace 5 hardcoded ComplianceCard scores (ISO 27001 92%, ISO 42001 45%, ISO 14001 78%, GDPR 98%, ADR 60%) with real compliance API data; remove hardcoded overall score 74.6 and '16 Total' action items; remove ISO 14001 card (irrelevant to SaaS); connect ComplianceTimeline and RiskHeatMap to live API endpoints; ensure ComplianceDetailPanel drilldown shows real control data; tests >=90%",Frontend Dev (STOA-Quality),"IFC-073,IFC-100,IFC-306",FILE:apps/web/src/app/governance/compliance/page.tsx;FILE:apps/web/src/app/governance/compliance/components/ComplianceTimeline.tsx;FILE:apps/web/src/app/api/compliance/timeline/route.ts;FILE:apps/web/src/app/api/compliance/[standardId]/route.ts;FILE:apps/web/src/app/api/compliance/risks/route.ts;DESIGN:docs/design/README.md,ComplianceCards load scores from API not hardcoded; overall score computed from live data; ISO 14001 card removed; ComplianceTimeline renders events from compliance-calendar.json; RiskHeatMap fetches from /api/compliance/risks; ComplianceDetailPanel shows real controls; Lighthouse >=90; test coverage >=90%; verified by: pnpm test,Backlog,0 hardcoded scores; API-driven cards; Lighthouse >=90; coverage >=90%,20,ARTIFACT:apps/web/src/app/governance/compliance/page.tsx;ARTIFACT:apps/web/src/app/governance/compliance/components/ComplianceTimeline.tsx;EVIDENCE:.specify/sprints/sprint-20/attestations/PG-194/context_ack.json,GATE:lighthouse-gte-90;VALIDATE:pnpm --filter web typecheck;VALIDATE:pnpm --filter web test --run;GATE:coverage-gte-90,60/120/240,,,0,"IFC-073:FS,IFC-100:FS,IFC-306:FS",
IFC-307,AI & Intelligence,"Contact Enrichment Pipeline — Automated background job that periodically enriches contact/lead data from external providers (Clearbit, Apollo). Includes: BullMQ queue intelliflow-contact-enrichment, enrichment adapter with rate limiting, on-create trigger in contact.router.ts, periodic cron sweep for stale profiles (>30 days), cost tracking via CostTracker, field updates (company, title, social profiles, industry)",Tech Lead (STOA-Domain),"IFC-168,IFC-131",FILE:apps/ai-worker/src/jobs/enrichment.job.ts;FILE:packages/adapters/src/enrichment/enrichment-provider.ts;FILE:apps/api/src/modules/contact/contact.router.ts,"External enrichment provider adapter with rate limiting; BullMQ queue intelliflow-contact-enrichment wired with producer on contact create; periodic cron sweep for stale profiles; cost tracking per call via CostTracker; contact fields updated: company, title, social profiles, industry; >=90% test coverage; all 4 validations pass",Backlog,Enrichment rate >=60%; API cost <$0.05 per call; Queue p95 <5s; Coverage >=90%,22,ARTIFACT:apps/ai-worker/src/chains/enrichment.chain.ts;ARTIFACT:apps/ai-worker/src/jobs/enrichment.job.ts;ARTIFACT:packages/adapters/src/enrichment/enrichment-provider.ts;EVIDENCE:.specify/sprints/sprint-22/attestations/IFC-307/context_ack.json,VALIDATE:pnpm typecheck;VALIDATE:pnpm test --run;VALIDATE:pnpm lint;VALIDATE:pnpm build;GATE:coverage-gte-90,300/480/780,,,0,"IFC-168:FS,IFC-131:FS",
IFC-308,AI & Intelligence,"Scheduled Report Generation — BullMQ cron job that generates daily/weekly analytics snapshots and emails summary reports to team leads. Includes: report template system (pipeline summary, lead conversion, revenue trends, SLA compliance), PDF/HTML report rendering, email delivery via notifications worker, configurable schedule per tenant, report archive storage",Tech Lead (STOA-Domain),"IFC-168,IFC-024",FILE:apps/ai-worker/src/jobs/report-generation.job.ts;FILE:apps/api/src/modules/analytics/analytics.router.ts;FILE:apps/api/src/modules/analytics/report-templates.ts,"4+ report templates (pipeline, leads, revenue, SLA); PDF/HTML rendering; email delivery via notifications worker; configurable schedule per tenant; report archive in storage; >=90% test coverage; all 4 validations pass",Backlog,>=4 report templates; >=99% delivery reliability; Generation p95 <30s; Coverage >=90%,24,ARTIFACT:apps/ai-worker/src/jobs/report-generation.job.ts;ARTIFACT:apps/api/src/modules/analytics/report-templates.ts;EVIDENCE:.specify/sprints/sprint-24/attestations/IFC-308/context_ack.json,VALIDATE:pnpm typecheck;VALIDATE:pnpm test --run;VALIDATE:pnpm lint;VALIDATE:pnpm build;GATE:coverage-gte-90,360/600/960,,,0,"IFC-168:FS,IFC-024:FS",