"Task ID","Section","Description","Owner","Dependencies","Pre-requisites","Definition of Done","Status","KPIs","Target Sprint","Artifacts To Track","Validation Method"
"PG-069","Core CRM","Accounts List","CRM FE+BE (STOA-Foundation)","IFC-089","FILE:artifacts/sprint0/codex-run/Framework.md;FILE:audit-matrix.yml;ENV:Account hierarchy;ENV:relationships;FILE:apps/api/src/modules/contact/contact.router.ts;FILE:docs/design/sitemap.md;FILE:docs/design/ui-flow-mapping.md;FILE:docs/design/page-registry.md;FILE:apps/project-tracker/docs/metrics/_global/flows/flow-index.md","Response <200ms, Lighthouse ≥90, hierarchy shown; artifacts: page.tsx, account-list.tsx, hierarchy-view.tsx","Backlog","Accounts listed, hierarchy displayed, relationships linked","19","ARTIFACT:apps/web/app/(crm)/accounts/page.tsx;ARTIFACT:apps/web/components/shared/account-list.tsx;ARTIFACT:apps/web/components/shared/hierarchy-view.tsx;EVIDENCE:artifacts/attestations/PG-069/context_ack.json","AUDIT:manual-review;GATE:lighthouse-gte-90"
"PG-070","Core CRM","Account Detail","CRM FE+BE (STOA-Foundation)","PG-069","FILE:artifacts/sprint0/codex-run/Framework.md;FILE:audit-matrix.yml;ENV:Account 360;ENV:subsidiaries;ENV:contacts;FILE:apps/web/app/(crm)/accounts/page.tsx;FILE:docs/design/sitemap.md;FILE:docs/design/ui-flow-mapping.md;FILE:docs/design/page-registry.md;FILE:apps/project-tracker/docs/metrics/_global/flows/flow-index.md","Response <200ms, Lighthouse ≥90, complete view; artifacts: page.tsx, account-detail.tsx, subsidiary-list.tsx","Backlog","Details complete, subsidiaries shown, contacts linked","20","ARTIFACT:apps/web/app/(crm)/accounts/[id]/page.tsx;ARTIFACT:apps/web/components/shared/account-detail.tsx;ARTIFACT:apps/web/components/shared/subsidiary-list.tsx;EVIDENCE:artifacts/attestations/PG-070/context_ack.json","AUDIT:manual-review;GATE:lighthouse-gte-90"
"PG-071","Core CRM","Edit Account","CRM FE+BE (STOA-Foundation)","PG-070","FILE:artifacts/sprint0/codex-run/Framework.md;FILE:audit-matrix.yml;ENV:Account editor;ENV:parent selection;FILE:apps/web/app/(crm)/accounts/[id]/page.tsx;FILE:docs/design/sitemap.md;FILE:docs/design/ui-flow-mapping.md;FILE:docs/design/page-registry.md;FILE:apps/project-tracker/docs/metrics/_global/flows/flow-index.md","Response <200ms, Lighthouse ≥90, updates saved; artifacts: page.tsx, account-editor.tsx, parent-selector.tsx","Backlog","Edits working, hierarchy updated, changes tracked","20","ARTIFACT:apps/web/app/(crm)/accounts/[id]/edit/page.tsx;ARTIFACT:apps/web/components/shared/account-editor.tsx;ARTIFACT:apps/web/components/shared/parent-selector.tsx;EVIDENCE:artifacts/attestations/PG-071/context_ack.json","AUDIT:manual-review;GATE:lighthouse-gte-90"
"PG-072","Core CRM","Import Accounts","CRM FE+BE (STOA-Foundation)","PG-069","FILE:artifacts/sprint0/codex-run/Framework.md;FILE:audit-matrix.yml;ENV:Account import;ENV:hierarchy mapping;FILE:apps/web/app/(crm)/accounts/page.tsx;FILE:docs/design/sitemap.md;FILE:docs/design/ui-flow-mapping.md;FILE:docs/design/page-registry.md;FILE:apps/project-tracker/docs/metrics/_global/flows/flow-index.md","Response <200ms, Lighthouse ≥90, imports structured; artifacts: page.tsx, account-importer.tsx, hierarchy-mapper.ts","Backlog","Imports working, hierarchy preserved, relationships mapped","20","ARTIFACT:apps/web/app/(crm)/accounts/import/page.tsx;ARTIFACT:apps/web/components/shared/account-importer.tsx;ARTIFACT:apps/web/lib/shared/hierarchy-mapper.ts;EVIDENCE:artifacts/attestations/PG-072/context_ack.json","AUDIT:manual-review;GATE:lighthouse-gte-90"
"PG-073","Core CRM","Opportunities List","CRM FE+BE (STOA-Foundation)","IFC-091","FILE:artifacts/sprint0/codex-run/Framework.md;FILE:audit-matrix.yml;ENV:Opportunity pipeline;ENV:stages;FILE:apps/api/src/modules/opportunity/opportunity.router.ts;FILE:docs/design/sitemap.md;FILE:docs/design/ui-flow-mapping.md;FILE:docs/design/page-registry.md;FILE:apps/project-tracker/docs/metrics/_global/flows/flow-index.md","Response <200ms, Lighthouse ≥90, pipeline visible; artifacts: page.tsx, opportunity-list.tsx, pipeline-view.tsx","Backlog","Opportunities listed, pipeline shown, stages clear","20","ARTIFACT:apps/web/app/(crm)/opportunities/page.tsx;ARTIFACT:apps/web/components/shared/opportunity-list.tsx;ARTIFACT:apps/web/components/shared/pipeline-view.tsx;EVIDENCE:artifacts/attestations/PG-073/context_ack.json","AUDIT:manual-review;GATE:lighthouse-gte-90"
"PG-074","Core CRM","Opportunity Detail","CRM FE+BE (STOA-Foundation)","PG-073","FILE:artifacts/sprint0/codex-run/Framework.md;FILE:audit-matrix.yml;ENV:Deal details;ENV:products;ENV:timeline;FILE:apps/web/app/(crm)/opportunities/page.tsx;FILE:docs/design/sitemap.md;FILE:docs/design/ui-flow-mapping.md;FILE:docs/design/page-registry.md;FILE:apps/project-tracker/docs/metrics/_global/flows/flow-index.md","Response <200ms, Lighthouse ≥90, details complete; artifacts: page.tsx, opportunity-detail.tsx, product-list.tsx","Backlog","Details shown, products listed, timeline displayed","20","ARTIFACT:apps/web/app/(crm)/opportunities/[id]/page.tsx;ARTIFACT:apps/web/components/shared/opportunity-detail.tsx;ARTIFACT:apps/web/components/shared/product-list.tsx;EVIDENCE:artifacts/attestations/PG-074/context_ack.json","AUDIT:manual-review;GATE:lighthouse-gte-90"
"PG-075","Core CRM","Edit Opportunity","CRM FE+BE (STOA-Foundation)","PG-074","FILE:artifacts/sprint0/codex-run/Framework.md;FILE:audit-matrix.yml;ENV:Deal editor;ENV:probability calc;FILE:apps/web/app/(crm)/opportunities/[id]/page.tsx;FILE:docs/design/sitemap.md;FILE:docs/design/ui-flow-mapping.md;FILE:docs/design/page-registry.md;FILE:apps/project-tracker/docs/metrics/_global/flows/flow-index.md","Response <200ms, Lighthouse ≥90, calculations accurate; artifacts: page.tsx, opportunity-editor.tsx, probability-calc.ts","Backlog","Edits working, probability calculated, forecast updated","20","ARTIFACT:apps/web/app/(crm)/opportunities/[id]/edit/page.tsx;ARTIFACT:apps/web/components/shared/opportunity-editor.tsx;ARTIFACT:apps/web/lib/shared/probability-calc.ts;EVIDENCE:artifacts/attestations/PG-075/context_ack.json","AUDIT:manual-review;GATE:lighthouse-gte-90"
"PG-076","Core CRM","Pipeline Board","CRM FE+BE (STOA-Foundation)","IFC-091","FILE:artifacts/sprint0/codex-run/Framework.md;FILE:audit-matrix.yml;ENV:Kanban view;ENV:drag-drop;ENV:filters;FILE:docs/operations/quality-gates.md;FILE:apps/api/src/modules/opportunity/opportunity.router.ts;FILE:docs/design/sitemap.md;FILE:docs/design/ui-flow-mapping.md;FILE:docs/design/page-registry.md;FILE:apps/project-tracker/docs/metrics/_global/flows/flow-index.md","Response <200ms, Lighthouse ≥90, drag smooth; artifacts: page.tsx, pipeline-board.tsx, drag-drop-handler.ts","Backlog","Board working, drag-drop smooth, filters functional","21","ARTIFACT:apps/web/app/(crm)/pipeline/page.tsx;ARTIFACT:apps/web/components/pipeline/pipeline-board.tsx;ARTIFACT:apps/web/lib/pipeline/drag-drop-handler.ts;EVIDENCE:artifacts/attestations/PG-076/context_ack.json","AUDIT:manual-review;GATE:lighthouse-gte-90"
"PG-077","Core CRM","Pipeline Stages","CRM FE+BE (STOA-Foundation)","PG-076","FILE:artifacts/sprint0/codex-run/Framework.md;FILE:audit-matrix.yml;ENV:Stage config;ENV:conversion rates;FILE:docs/operations/quality-gates.md;FILE:apps/web/app/(crm)/pipeline/page.tsx;FILE:docs/design/sitemap.md;FILE:docs/design/ui-flow-mapping.md;FILE:docs/design/page-registry.md;FILE:apps/project-tracker/docs/metrics/_global/flows/flow-index.md","Response <200ms, Lighthouse ≥90, rates calculated; artifacts: page.tsx, stage-config.tsx, conversion-calculator.ts","Backlog","Stages configured, rates calculated, insights shown","21","ARTIFACT:apps/web/app/(crm)/pipeline/stages/page.tsx;ARTIFACT:apps/web/components/pipeline/stage-config.tsx;ARTIFACT:apps/web/lib/pipeline/conversion-calculator.ts;EVIDENCE:artifacts/attestations/PG-077/context_ack.json","AUDIT:manual-review;GATE:lighthouse-gte-90"
"PG-078","Core CRM","Stage Detail","CRM FE+BE (STOA-Foundation)","PG-077","FILE:artifacts/sprint0/codex-run/Framework.md;FILE:audit-matrix.yml;ENV:Stage analytics;ENV:bottlenecks;FILE:apps/web/app/(crm)/pipeline/stages/page.tsx;FILE:docs/design/sitemap.md;FILE:docs/design/ui-flow-mapping.md;FILE:docs/design/page-registry.md;FILE:apps/project-tracker/docs/metrics/_global/flows/flow-index.md","Response <200ms, Lighthouse ≥90, analytics shown; artifacts: page.tsx, stage-analytics.tsx, bottleneck-analyzer.ts","Backlog","Analytics displayed, bottlenecks identified, actions suggested","21","ARTIFACT:apps/web/app/(crm)/pipeline/stages/[id]/page.tsx;ARTIFACT:apps/web/components/shared/stage-analytics.tsx;ARTIFACT:apps/web/lib/shared/bottleneck-analyzer.ts;EVIDENCE:artifacts/attestations/PG-078/context_ack.json","AUDIT:manual-review;GATE:lighthouse-gte-90"
"PG-079","Core CRM","Forecasts","CRM FE+BE (STOA-Foundation)","IFC-092","FILE:artifacts/sprint0/codex-run/Framework.md;FILE:audit-matrix.yml;ENV:Forecast models;ENV:accuracy tracking;FILE:apps/api/src/shared/forecast-algorithm-tests.ts;FILE:docs/design/sitemap.md;FILE:docs/design/ui-flow-mapping.md;FILE:docs/design/page-registry.md;FILE:apps/project-tracker/docs/metrics/_global/flows/flow-index.md","Response <200ms, Lighthouse ≥90, forecasts accurate; artifacts: page.tsx, forecast-display.tsx, accuracy-tracker.ts","Backlog","Forecasts generated, accuracy tracked, adjustments enabled","21","ARTIFACT:apps/web/app/(crm)/forecasts/page.tsx;ARTIFACT:apps/web/components/shared/forecast-display.tsx;ARTIFACT:apps/web/lib/shared/accuracy-tracker.ts;EVIDENCE:artifacts/attestations/PG-079/context_ack.json","AUDIT:manual-review;GATE:lighthouse-gte-90"
"PG-080","Core CRM","Activities","CRM FE+BE (STOA-Foundation)","IFC-089","FILE:artifacts/sprint0/codex-run/Framework.md;FILE:audit-matrix.yml;ENV:Activity timeline;ENV:filters;FILE:apps/api/src/modules/contact/contact.router.ts;FILE:docs/design/sitemap.md;FILE:docs/design/ui-flow-mapping.md;FILE:docs/design/page-registry.md;FILE:apps/project-tracker/docs/metrics/_global/flows/flow-index.md","Response <200ms, Lighthouse ≥90, timeline smooth; artifacts: page.tsx, activity-timeline.tsx, activity-filters.tsx","Backlog","Activities listed, timeline smooth, filters working","21","ARTIFACT:apps/web/app/(crm)/activities/page.tsx;ARTIFACT:apps/web/components/shared/activity-timeline.tsx;ARTIFACT:apps/web/components/shared/activity-filters.tsx;EVIDENCE:artifacts/attestations/PG-080/context_ack.json","AUDIT:manual-review;GATE:lighthouse-gte-90"
"PG-081","Core CRM","Tasks","CRM FE+BE (STOA-Foundation)","PG-080","FILE:artifacts/sprint0/codex-run/Framework.md;FILE:audit-matrix.yml;ENV:Task management;ENV:assignments;FILE:apps/web/app/(crm)/activities/page.tsx;FILE:docs/design/sitemap.md;FILE:docs/design/ui-flow-mapping.md;FILE:docs/design/page-registry.md;FILE:apps/project-tracker/docs/metrics/_global/flows/flow-index.md","Response <200ms, Lighthouse ≥90, tasks tracked; artifacts: page.tsx, task-manager.tsx, task-reminder.ts","Backlog","Tasks managed, assignments working, reminders sent","21","ARTIFACT:apps/web/app/(crm)/tasks/page.tsx;ARTIFACT:apps/web/components/shared/task-manager.tsx;ARTIFACT:apps/web/lib/shared/task-reminder.ts;EVIDENCE:artifacts/attestations/PG-081/context_ack.json","AUDIT:manual-review;GATE:lighthouse-gte-90"
"PG-082","Core CRM","Task Detail","CRM FE+BE (STOA-Foundation)","PG-081","FILE:artifacts/sprint0/codex-run/Framework.md;FILE:audit-matrix.yml;ENV:Task view;ENV:subtasks;ENV:comments;FILE:apps/web/app/(crm)/tasks/page.tsx;FILE:docs/design/sitemap.md;FILE:docs/design/ui-flow-mapping.md;FILE:docs/design/page-registry.md;FILE:apps/project-tracker/docs/metrics/_global/flows/flow-index.md","Response <200ms, Lighthouse ≥90, collaboration enabled; artifacts: page.tsx, task-detail.tsx, task-comments.tsx","Backlog","Details shown, subtasks managed, comments working","22","ARTIFACT:apps/web/app/(crm)/tasks/[id]/page.tsx;ARTIFACT:apps/web/components/shared/task-detail.tsx;ARTIFACT:apps/web/components/shared/task-comments.tsx;EVIDENCE:artifacts/attestations/PG-082/context_ack.json","AUDIT:manual-review;GATE:lighthouse-gte-90"
"DOC-001","Strategy & Documentation","Company & Product Master Brief (single source of truth)","CEO + All Leads (STOA-Leadership)","","FILE:artifacts/sprint0/codex-run/Framework.md;FILE:audit-matrix.yml;ENV:Stakeholder workshop (CEO/PM/Tech Lead); access to existing notes;ENV:competitive context;ENV:and current product scope;FILE:docs/shared/review-checklist.md;FILE:docs/operations/pr-checklist.md","Master brief created and reviewed covering: product definition, vision, target customers (ICP), personas, positioning, value proposition, differentiation, success metrics, scope/out-of-scope, tone of voice, and visual identity direction; published as tracked docs and referenced from CLAUDE.md/README as grounding source; targets: >=100%; verified by: pnpm lint","Completed","100% required sections filled; ≤5 open questions; referenced by agents/CI docs checks; updated_at + owner present","0","ARTIFACT:docs/company/master-brief.md; docs/company/product/product-vision.md; docs/company/go-to-market/icp-personas.md; docs/company/messaging/tone-of-voice.md; docs/company/brand/visual-identity.md;EVIDENCE:artifacts/attestations/DOC-001/context_ack.json","VALIDATE:pnpm lint"
"BRAND-001","Brand & Design","Visual Identity System (palette, typography, spacing, logo usage)","UX Designer + Frontend Dev (STOA-Domain)","DOC-001","FILE:artifacts/sprint0/codex-run/Framework.md;FILE:audit-matrix.yml;ENV:Access to any existing brand assets; decision-maker availability for final selection;FILE:docs/planning/DDD-context-map.puml;FILE:packages/db/prisma/schema.prisma;FILE:docs/operations/quality-gates.md;FILE:docs/company/brand/visual-identity.md;FILE:docs/company/master-brief.md","Defined palette (primary/secondary/neutral), typography scale, spacing system, iconography guidance, and basic component styling principles; includes do/don’t examples; exported as machine-readable tokens (JSON) and documented usage guidance; verified by: pnpm lint","Completed","Palette + type scale defined; tokens generated; 1 review iteration max; consistency checklist created","0","ARTIFACT:docs/company/brand/visual-identity.md; docs/company/brand/palette.tokens.json; docs/company/brand/typography.tokens.json; docs/company/brand/spacing.tokens.json;EVIDENCE:artifacts/attestations/BRAND-001/context_ack.json","VALIDATE:pnpm lint;AUDIT:design-review;AUDIT:code-review"
"BRAND-002","Design System","Design Tokens Integration Plan (Tailwind/shadcn theme mapping)","Frontend Dev + UX Designer (STOA-Domain)","BRAND-001,ENV-002-AI","FILE:artifacts/sprint0/codex-run/Framework.md;FILE:audit-matrix.yml;ENV:Tailwind + shadcn/ui baseline present; agreement on token naming convention;FILE:docs/design-system/token-mapping.md;FILE:docs/company/brand/visual-identity.md;FILE:.eslintrc.js","Mapping document from brand tokens to Tailwind/shadcn variables created; includes light/dark theme rules, semantic color tokens, component states, and migration guidelines; produces a minimal theme reference"" page spec""; targets: >=90%, zero errors; verified by: pnpm lint","Completed","Token mapping coverage ≥90% of components used in Sprint 0/1; zero ambiguous token names; theme reference spec approved","1","ARTIFACT:docs/design-system/token-mapping.md; docs/design-system/theme-reference-spec.md; docs/design-system/token-naming.md;EVIDENCE:artifacts/attestations/BRAND-002/context_ack.json","VALIDATE:pnpm lint"
"GTM-001","Go-to-Market","ICP & Personas Pack (target customers, job stories, objections)","PM + Marketing (STOA-Foundation)","DOC-001","FILE:artifacts/sprint0/codex-run/Framework.md;FILE:audit-matrix.yml;ENV:Access to intended market assumptions; any existing customer discovery notes;FILE:docs/company/master-brief.md","ICP definition (firmographics/technographics/constraints), 2–4 personas with job stories, triggers, pains, gains, buying process, and objections; includes “not ICP” exclusions; stored as tracked docs; verified by: pnpm lint; output: icp.md, personas.md, objections.md validated","Completed","ICP + ≥2 personas complete; ≥10 objections/answers; clear “not ICP” list; referenced by Sales assets","0","ARTIFACT:docs/company/go-to-market/icp.md; docs/company/go-to-market/personas.md; docs/company/go-to-market/objections.md;EVIDENCE:artifacts/attestations/GTM-001/context_ack.json","VALIDATE:pnpm lint"
"GTM-002","Go-to-Market","Messaging Framework (positioning, value props, copy blocks)","PM + Marketing (STOA-Foundation)","GTM-001,BRAND-001","FILE:artifacts/sprint0/codex-run/Framework.md;FILE:audit-matrix.yml;ENV:Approval of ICP/personas; preliminary visual identity direction;FILE:docs/shared/review-checklist.md;FILE:docs/operations/pr-checklist.md;FILE:docs/company/go-to-market/icp.md;FILE:docs/company/brand/visual-identity.md","Positioning statement, elevator pitch, key messages by persona, CTA library, website copy blocks (hero, features, pricing, security), and tone-of-voice rules; includes examples for consistent writing; verified by: pnpm lint; output: positioning.md, value-props.md, copy-blocks.md validated","Completed","Copy blocks cover all PG pages; tone guide ≤2 pages and actionable; ≤1 unresolved positioning decision","0","ARTIFACT:docs/company/messaging/positioning.md; docs/company/messaging/value-props.md; docs/company/messaging/copy-blocks.md; docs/company/messaging/cta-library.md;EVIDENCE:artifacts/attestations/GTM-002/context_ack.json","VALIDATE:pnpm lint;AUDIT:security-review"
"SALES-001","Commercial Assets","Commercial Narrative + Pitch Deck Outline + One-Pager","PM + Sales Team (STOA-Foundation)","GTM-002,BRAND-001","FILE:artifacts/sprint0/codex-run/Framework.md;FILE:audit-matrix.yml;POLICY:Agreement on positioning and visuals; selected distribution channel (web/demo/outreach);FILE:docs/operations/quality-gates.md;FILE:docs/company/messaging/positioning.md;FILE:docs/company/brand/visual-identity.md","Deck outline (10–12 slides) with story arc, slide-by-slide content, and visual guidelines; plus one-pager (problem → solution → proof → CTA); includes a single canonical link to design source (Figma/Canva); verified by: pnpm lint","Completed","Deck outline complete; one-pager complete; 1 internal review cycle; aligns with ICP/personas","1","ARTIFACT:docs/sales/pitch-deck-outline.md; docs/sales/one-pager.md; artifacts/misc/sales/pitch-deck-source-link.txt;ARTIFACT:artifacts/reports/SALES-001-quick-reference.md;ARTIFACT:artifacts/reports/SALES-001-validation-report.md;EVIDENCE:artifacts/attestations/SALES-001/context_ack.json","VALIDATE:pnpm lint"
"SALES-002","Commercial Assets","Sales Motion Playbook (outreach sequences, discovery + demo scripts)","Sales + CEO (STOA-Leadership)","SALES-001,GTM-002","FILE:artifacts/sprint0/codex-run/Framework.md;FILE:audit-matrix.yml;ENV:Agreement on commercial narrative; chosen qualification framework (BANT/MEDDIC/etc.);FILE:docs/sales/pitch-deck-outline.md;FILE:docs/company/messaging/positioning.md","Defined sales motion: lead sources, qualification steps, discovery script, demo script, objection handling, follow-up cadence; includes at least 2 outreach sequences (email + LinkedIn) and a handoff policy to implementation/support; artifacts: sales-motion-playbook.md, discovery-script.md, demo-script.md; verified by: pnpm lint","Completed","≥2 sequences ready; discovery+demo scripts usable end-to-end; first pilot run documented","2","ARTIFACT:docs/sales/sales-motion-playbook.md; docs/sales/discovery-script.md; docs/sales/demo-script.md; docs/sales/outreach-sequences.md;EVIDENCE:artifacts/attestations/SALES-002/context_ack.json","VALIDATE:pnpm lint;AUDIT:code-review"
"PM-OPS-001","Project Operations","Project Operating Model & Delivery Playbook (cadence, WIP, ticket sizing, ABC)","Tech Lead + DevOps + Product Manager (STOA-Automation)","AUTOMATION-001,ENV-005-AI","FILE:artifacts/sprint0/codex-run/Framework.md;FILE:audit-matrix.yml;ENV:Agreement on repo workflow and tracker usage; availability of team roles and responsibilities;FILE:packages/db/prisma/schema.prisma;FILE:docs/shared/review-checklist.md;FILE:docs/operations/pr-checklist.md;FILE:docs/operations/project-playbook.md;FILE:artifacts/misc/orchestration-config.yaml;FILE:.github/workflows/ci.yml","Documented end-to-end delivery model: stages, sequencing, WIP policy, ticket sizing guidance, ABC classification of work, acceptance criteria rules, and escalation path; includes RACI for Sprint 0–2; referenced by tracker UI/help pages; targets: >=100%; verified by: pnpm lint","Completed","WIP policy defined; ticket sizing heuristic defined; ABC coverage 100% of task types; RACI approved","0","ARTIFACT:docs/operations/project-playbook.md; docs/operations/wip-policy.md; docs/operations/ticket-sizing.md; docs/operations/abc-classification.md; docs/operations/raci.md;EVIDENCE:artifacts/attestations/PM-OPS-001/context_ack.json","VALIDATE:pnpm lint"
"ENG-OPS-001","Engineering Operations","Engineering Playbook (SDLC, PR rules, quality gates, release/rollback)","Tech Lead + DevOps + QA Lead (STOA-Quality)","ENV-002-AI,ENV-005-AI,ENV-010-AI","FILE:artifacts/sprint0/codex-run/Framework.md;FILE:audit-matrix.yml;ENV:CI pipeline baseline; lint/typecheck/test scripts present;FILE:docs/planning/adr/ADR-005-workflow-engine.md;FILE:docs/shared/review-checklist.md;FILE:docs/operations/engineering-playbook.md;FILE:docs/operations/quality-gates.md;FILE:docs/operations/pr-checklist.md;FILE:docs/operations/release-rollback.md;FILE:.eslintrc.js;FILE:.github/workflows/ci.yml;FILE:artifacts/coverage/index.html","Engineering handbook written: branching strategy, PR checklist, code review standards, required gates (audit-matrix Tier 1), release flow, rollback steps, incident basics, and docs conventions; includes strict vs local"" policy for WARN/FAIL""; verified by: pnpm lint","Completed","PR checklist adopted; gate mapping complete; rollback procedure documented; ≤1 page fast path"" summary included""","0","ARTIFACT:docs/operations/engineering-playbook.md; docs/operations/quality-gates.md; docs/operations/pr-checklist.md; docs/operations/release-rollback.md;EVIDENCE:artifacts/attestations/ENG-OPS-001/context_ack.json","VALIDATE:pnpm lint"
"GOV-001","Architecture Governance","Architecture Governance Pack (ADR + ARP templates, decision workflow, flowcharts)","Backend Dev + Architect (STOA-Domain)","ENG-OPS-001","FILE:artifacts/sprint0/codex-run/Framework.md;FILE:audit-matrix.yml;ENV:Agreement on architecture conventions (C4/diagrams); decision authority clarified;FILE:docs/planning/adr/ADR-001-modern-stack.md;FILE:docs/planning/adr/ADR-005-workflow-engine.md;FILE:docs/architecture/hex-boundaries.md;FILE:docs/architecture/repo-layout.md;FILE:docs/planning/DDD-context-map.puml;FILE:docs/operations/quality-gates.md;FILE:docs/architecture/adr/000-template.md;FILE:docs/architecture/decision-workflow.md;FILE:docs/operations/engineering-playbook.md","Created ADR template, ARP template, decision workflow, and diagram/flowchart conventions; includes folder structure, naming, and example ADR/ARP; defines when decisions are required and how to approve; verified by: pnpm lint","Completed","Templates published; workflow clear; at least 1 example ADR/ARP; adoption guide ≤1 page","1","ARTIFACT:docs/architecture/adr/000-template.md; docs/architecture/arp/000-template.md; docs/architecture/decision-workflow.md; docs/architecture/diagrams/README.md; docs/architecture/flowcharts/README.md;EVIDENCE:artifacts/attestations/GOV-001/context_ack.json","VALIDATE:pnpm lint"
"ANALYTICS-001","Analytics & Segmentation","Customer Segmentation Spec (RFM + ABC) + Event Taxonomy","PM + DA (STOA-Foundation)","DOC-001,GTM-001","FILE:artifacts/sprint0/codex-run/Framework.md;FILE:audit-matrix.yml;ENV:Access to ICP/personas; agreement on CRM prioritization goals; any existing analytics assumptions;FILE:docs/company/master-brief.md;FILE:docs/company/go-to-market/icp.md","Defines RFM inputs/outputs, ABC curve methodology, segmentation thresholds, and event taxonomy; specifies dashboards, KPIs, and minimal instrumentation requirements to support CRM prioritization; includes data privacy notes and open questions log; artifacts: rfm-abc-spec.md, event-taxonomy.md, dashboards-requirements.md; verified by: pnpm lint","Completed","RFM/ABC spec complete; event taxonomy covers core flows; requirements mapped to ENV-016-AI + IFC-037/038; ≤5 open questions","0","ARTIFACT:docs/analytics/rfm-abc-spec.md; docs/analytics/event-taxonomy.md; docs/analytics/dashboards-requirements.md;EVIDENCE:artifacts/attestations/ANALYTICS-001/context_ack.json","VALIDATE:pnpm lint"
"PG-083","Core CRM","Calendar","CRM FE+BE (STOA-Foundation)","PG-080","FILE:artifacts/sprint0/codex-run/Framework.md;FILE:audit-matrix.yml;ENV:Calendar integration;ENV:scheduling;FILE:apps/web/app/(crm)/activities/page.tsx;FILE:docs/design/sitemap.md;FILE:docs/design/ui-flow-mapping.md;FILE:docs/design/page-registry.md;FILE:apps/project-tracker/docs/metrics/_global/flows/flow-index.md","Response <200ms, Lighthouse ≥90, events synced; artifacts: page.tsx, calendar-view.tsx, event-scheduler.ts","Backlog","Calendar working, events synced, scheduling functional","22","ARTIFACT:apps/web/app/(crm)/calendar/page.tsx;ARTIFACT:apps/web/components/calendar/calendar-view.tsx;ARTIFACT:apps/web/lib/calendar/event-scheduler.ts;EVIDENCE:artifacts/attestations/PG-083/context_ack.json","AUDIT:manual-review;GATE:lighthouse-gte-90"
